caseID,verbatim,1,2,3,4,5,6,7,8,9,10,11,12,13,14,15,16,17,18,19,20,21,22,24,25,96,97
1,"FIRST OBJECTIVE WAS TO WIPE OUT ECONOMIC SYSTEM, SECOND TO KILL THE POLITICAL LEADERS OF THE COUNTRY, THIRD DEMORILIZE THE POPULAS//NO",0,0,1,0,0,0,0,0,0,1,0,0,0,0,0,1,0,0,0,0,0,0,0,0,0,1
3,striking fear in the US towards the Taliban//no,1,0,0,0,0,0,0,0,0,0,0,0,0,0,0,0,0,0,0,0,0,0,0,0,0,1
4,STOP THE CONTROL OF POWER OF PRESIDENT BUSH IN THE WORLD//NO,0,0,0,0,0,0,0,0,0,0,0,0,0,0,0,1,0,0,0,0,0,0,0,0,0,1
5,they were trying to show our vulnerability than anything else//they'll stop at nothing//no,0,0,0,0,1,0,0,0,0,0,0,0,0,0,0,0,0,0,0,0,0,0,1,0,0,1
7,TERROR//PANIC//FEAR//NO,1,0,0,0,0,0,0,0,0,0,0,0,0,0,0,0,0,0,0,0,0,0,0,0,0,1
8,"cause more caious in the world//they are trying to ALA back, radical muslims//no",0,0,1,0,0,0,0,0,0,0,0,0,0,0,0,0,1,0,0,0,0,1,0,0,0,1
9,FEAR//FEAR OF OUR SECURITY//NO,1,0,0,0,0,0,0,0,0,0,0,0,0,0,0,0,0,0,0,0,0,0,0,0,0,1
10,IT WAS A WAY OF TRYING TO DESTROY/MAKE A STATEMENT AGAINST AMERICAN GOVERNMENT AND PEOPLE//NO,0,0,0,0,0,0,1,0,0,0,1,0,0,0,0,0,0,0,0,0,0,0,0,0,0,1
11,"THAT THEY WERE TRYING TO SCARE THE CITIZENS OF THE UNITED STATES, AND R FEELS THAT THEY SUCCEEDED//NO",1,0,0,0,0,0,0,0,0,0,0,0,0,0,0,0,0,0,0,0,0,0,0,0,0,1
12,"TO SHOW THAT THEY HAD CONTROL OF OUR COUNTRY//THEY DON'T LIKE BUSH AND THAT WAS A STRIKE AGAINST HIM, SO THEY CAME AFTER OUR COUNTRY//IR FEELS BUSH IS BAD",0,0,0,0,1,0,1,0,0,0,0,0,0,0,0,1,0,0,1,0,0,0,0,0,0,0
13,their hatred for out country trying to be big brother to the world and their countries//no,0,0,0,0,0,0,0,0,0,0,0,1,0,0,0,0,0,0,1,0,0,0,1,0,0,1
14,I think they were probably trying to start a war.,0,0,0,0,0,1,0,0,0,0,0,0,0,0,0,0,0,0,0,0,0,0,0,0,0,0
15,I WATCHED THAT..I SAW THE PLANES WHEN THEY CRASHED IN// I THINK THEY WANTED TO SHOW THE POWER THEY HAD AND TO SHOW A THREAT TO OUR FORM OF GOVERNMENT//,1,0,0,0,1,0,0,0,0,0,0,0,0,0,0,0,0,0,0,0,0,0,1,0,0,0
16,To show their own power and incite fear in us.  I don't think they realized at that time what that was going to do to us economically.,1,0,0,0,1,0,0,0,0,1,0,0,0,0,0,0,0,0,0,0,0,0,0,0,0,0
17,i think they were trying to show us that they aren't scared of us... that they aren't scared to kill us// they were just trying to prove they're not scared of the U.S.// they don't care for our beliefs// they don't care... by killing a whole bunch of us at one time... they don't care// i doubt they're going to take over... i highly doubt that// i think they were trying to do what their religion... their god told them to do// they thought the people deserved to die//,0,0,0,1,1,0,0,0,0,0,0,0,0,0,0,0,0,0,1,0,0,1,1,0,0,0
18,they didn't approve of the United States I guess,0,0,0,0,0,0,0,0,0,0,0,0,0,0,0,0,0,0,1,0,0,0,0,0,0,0
19,"THE TERRORISTS WERE TRYING TO STRIKE AT THE CORE OF OUR BELIEFS, BUT DESTROYING OUR SEAT OF GOVERNMENT - BOTH THE STRUCTURE AND THOSE WITHIN IN, AND OUR MILITARY BY DESTROYING THE PREMIERE STRUCTURE OF IT AND THE PEOPLE IN IT, TO PUT FEAR INTO THE HEARTS OF THE AMERICANS AND COWER US... MAKE US AFRAID, AND DISRUPT OUR ECONOMY AT THE SAME TIME// AND REDUCE OUR STANDING INTERNATIONALLY//",1,0,0,0,0,0,1,0,1,1,1,0,0,0,0,0,0,0,0,0,0,0,0,0,0,0
20,I think they were trying to cause dissension in America... and to prove that they could do it.,0,0,1,0,1,0,0,0,0,0,0,0,0,0,0,0,0,0,0,0,0,0,0,0,0,0
21,spiritual peace// a promise of something good for doing their duty... //,0,0,0,0,0,0,0,0,0,0,0,0,0,0,0,0,0,0,0,1,0,1,0,0,0,0
22,attention//no,0,0,0,0,0,0,0,0,0,0,0,0,0,0,0,0,0,0,0,1,0,0,0,0,0,1
23,saying the united states is weak,0,0,0,0,1,0,0,0,0,0,0,0,0,0,0,0,0,0,0,0,0,0,0,0,0,0
24,destroy the most powerful country for personal problems by killing inocent people//no,0,0,0,0,0,0,1,0,0,0,0,0,0,0,0,0,0,0,0,0,0,0,0,1,0,1
25,they were trying to bring down the united states,0,0,0,0,0,0,1,0,0,0,0,0,0,0,0,0,0,0,0,0,0,0,0,0,0,0
27,to scare the people of the united states and show he world how weak we are,1,0,0,0,1,0,0,0,0,0,0,0,0,0,0,0,0,0,0,0,0,0,0,0,0,0
28,they were trying to disrupt the us involment in eastern affairs,0,0,0,0,0,0,0,0,0,0,0,1,0,0,0,0,0,0,0,0,0,0,0,0,0,0
29,taking out our financial place and goverment officials,0,0,0,0,0,0,0,0,0,1,1,0,0,0,0,0,0,0,0,0,0,0,0,0,0,0
30,make a statement,0,0,0,0,0,0,0,0,0,0,0,0,0,0,0,0,0,0,0,1,0,0,0,0,0,0
31,make us vulnerable,0,0,0,0,1,0,0,0,0,0,0,0,0,0,0,0,0,0,0,0,0,0,0,0,0,0
32,let you know we are vulnerable,0,0,0,0,1,0,0,0,0,0,0,0,0,0,0,0,0,0,0,0,0,0,0,0,0,0
33,to jab a stick into our side,0,1,0,0,0,0,0,0,0,0,0,0,0,0,0,0,0,0,0,0,0,0,0,0,0,0
34,put fear into America,1,0,0,0,0,0,0,0,0,0,0,0,0,0,0,0,0,0,0,0,0,0,0,0,0,0
35,fear//control//no,1,0,0,0,1,0,0,0,0,0,0,0,0,0,0,0,0,0,0,0,0,0,0,0,0,1
36,trying to attract attention,0,0,0,0,0,0,0,0,0,0,0,0,0,0,0,0,0,0,0,1,0,0,0,0,0,0
37,sending a threat,0,0,0,0,1,0,0,0,0,0,0,0,0,0,0,0,0,0,0,0,0,0,0,0,0,0
38,DISRUPT OUR POLITICAL AND ECONOMIC STRUCTURE,0,0,0,0,0,0,0,0,0,1,1,0,0,0,0,0,0,0,0,0,0,0,0,0,0,0
39,get across that they are a threat to the US people,0,0,0,0,1,0,0,0,0,0,0,0,0,0,0,0,0,0,0,0,0,0,0,0,0,0
40,to bring down our government,0,0,0,0,0,0,0,0,0,0,1,0,0,0,0,0,0,0,0,0,0,0,0,0,0,0
41,expose the U.S. vulnerability,0,0,0,0,1,0,0,0,0,0,0,0,0,0,0,0,0,0,0,0,0,0,0,0,0,0
42,destroy the weaknesses,0,0,0,0,1,0,0,0,0,0,0,0,0,0,0,0,0,0,0,0,0,0,0,0,0,0
43,get noticed,0,0,0,0,0,0,0,0,0,0,0,0,0,0,0,0,0,0,0,1,0,0,0,0,0,0
44,let the american public know that we are in reach and there could be more terrorist attacks,0,0,0,0,1,0,0,0,0,0,0,0,0,0,0,0,0,0,0,0,0,0,0,0,0,0
45,to destroy the government,0,0,0,0,0,0,0,0,0,0,1,0,0,0,0,0,0,0,0,0,0,0,0,0,0,0
46,terror,1,0,0,0,0,0,0,0,0,0,0,0,0,0,0,0,0,0,0,0,0,0,0,0,0,0
47,collapse the economy and bring terror to the free world,1,0,0,0,0,0,0,0,0,1,0,0,0,0,0,0,0,0,0,0,0,0,0,0,0,0
48,take revenge or response to the US having military bases in the middle east,0,0,0,0,0,0,0,0,0,0,0,1,1,0,0,0,0,0,0,0,0,0,0,0,0,0
49,make us fearful,1,0,0,0,0,0,0,0,0,0,0,0,0,0,0,0,0,0,0,0,0,0,0,0,0,0
50,fear,1,0,0,0,0,0,0,0,0,0,0,0,0,0,0,0,0,0,0,0,0,0,0,0,0,0
51,disrupt the economic and government controlled centers,0,0,0,0,0,0,0,0,0,1,1,0,0,0,0,0,0,0,0,0,0,0,0,0,0,0
52,let us know that they are as big as they are,0,0,0,0,1,0,0,0,0,0,0,0,0,0,0,0,0,0,0,0,0,0,0,0,0,0
54,attention,0,0,0,0,0,0,0,0,0,0,0,0,0,0,0,0,0,0,0,1,0,0,0,0,0,0
55,to instal fear,1,0,0,0,0,0,0,0,0,0,0,0,0,0,0,0,0,0,0,0,0,0,0,0,0,0
56,get power,0,0,0,0,1,0,0,0,0,0,0,0,0,0,0,0,0,0,0,0,0,0,0,0,0,0
57,economic problems,0,0,0,0,0,0,0,0,0,0,0,0,0,0,0,0,0,0,0,0,0,0,1,0,0,0
59,to getthe government to notice them and they like to be in control,0,0,0,0,1,0,0,0,0,0,0,0,0,0,0,0,0,0,0,1,0,0,0,0,0,0
60,<DK>,0,0,0,0,0,0,0,0,0,0,0,0,0,0,0,0,0,0,0,0,0,0,0,0,1,0
61,show that we can be hurt,0,0,0,0,1,0,0,0,0,0,0,0,0,0,0,0,0,0,0,0,0,0,0,0,0,0
62,to terrorized and killnpeople make a statemant,1,0,0,1,0,0,0,0,0,0,0,0,0,0,0,0,0,0,0,1,0,0,0,0,0,0
63,take nus of power and finantial distruction,0,0,0,0,1,0,0,0,0,1,0,0,0,0,0,0,0,0,0,0,0,0,0,0,0,0
64,<DK>,0,0,0,0,0,0,0,0,0,0,0,0,0,0,0,0,0,0,0,0,0,0,0,0,1,0
65,they were trying to destroy the us financial economy and \ exert their power\no,0,0,0,0,1,0,0,0,0,1,0,0,0,0,0,0,0,0,0,0,0,0,0,0,0,1
66,to send a messge about how much american policies are hated by their groups and to make the american people afraid\\no,1,0,0,0,0,0,0,0,0,0,0,0,0,0,0,0,0,0,1,0,0,0,0,0,0,1
67,"prove a point\\they actually wanted to see what they could do to do more to the us, see if we were weak\\want us to be all muslims\\no",0,0,0,0,1,0,0,0,0,0,0,0,0,0,0,0,0,0,0,1,0,1,0,0,0,1
68,"i do not agree that there were terrorists, i'm not sure, i'm pretty sure but i don't answer that\\no",0,0,0,0,0,0,0,0,0,0,0,0,0,0,0,0,0,0,0,0,0,0,0,1,1,1
69,i think they were trying to express rage but i'm not sure about what\no,0,0,0,0,0,0,0,0,0,0,0,0,0,0,0,0,0,0,1,0,0,0,0,0,1,1
71,i think they were trying to show the world that they were at war with the us\and to cause as much damage as they could\no,0,0,0,0,0,1,1,0,0,0,0,0,0,0,0,0,0,0,0,0,0,0,0,0,0,1
72,try to make us feel vulnerable\no,0,0,0,0,1,0,0,0,0,0,0,0,0,0,0,0,0,0,0,0,0,0,0,0,0,1
73,"i don't know, yeah i don't know",0,0,0,0,0,0,0,0,0,0,0,0,0,0,0,0,0,0,0,0,0,0,0,0,1,0
74,i'm not sure\\no,0,0,0,0,0,0,0,0,0,0,0,0,0,0,0,0,0,0,0,0,0,0,0,0,1,1
75,i think they were carrying out orders\\no,0,0,0,0,0,0,0,0,0,0,0,0,0,0,0,0,0,0,0,0,0,0,1,0,0,1
76,i think our govt was behind it and was trying to establish the climate of fear to go into iraq\no,1,0,0,0,0,0,0,0,0,0,0,0,0,0,0,0,0,0,0,0,1,0,0,0,0,1
77,"i guess for staraters to get the americans out of the muslim holy lands in the middle east,to seek revenge for insults americans made against the islamic faith, damage the american economy,to i guess make americans feel some of the fear that people in the middle east feel, \\ i think they were trying to be faithful to their religious creed and get into heaven \\no",1,0,0,0,0,0,0,0,0,1,0,1,1,0,0,0,0,0,0,0,0,1,0,0,0,1
78,"express frustration \and it was a military attack, their intention was to kill people, spreade fear, destabilize, cause panic but mostly they wanted attention, they wanted the world to look\no",1,0,1,1,0,1,0,0,0,0,0,0,0,0,0,0,0,0,1,1,0,0,0,0,0,1
79,"i don't know\\i really don't know, i have no clue why they did that\\no",0,0,0,0,0,0,0,0,0,0,0,0,0,0,0,0,0,0,0,0,0,0,0,0,1,1
80,psychological warfare on americans\and to get us into a war in the middle east that would break our economy\no,0,0,1,0,0,1,0,0,0,1,0,0,0,0,0,0,0,0,0,0,0,0,0,0,0,1
81,kill alot of people,0,0,0,1,0,0,0,0,0,0,0,0,0,0,0,0,0,0,0,0,0,0,0,0,0,0
82,making a statement//that tey can,0,0,0,0,1,0,0,0,0,0,0,0,0,0,0,0,0,0,0,1,0,0,0,0,0,0
83,"they crashed in the wrong place, I think they were after the president, I think they were on the wrong course",0,0,0,0,0,0,0,0,0,0,0,0,0,0,0,1,0,0,0,0,0,0,1,0,0,0
85,"destruction, fear,",1,0,0,0,0,0,1,0,0,0,0,0,0,0,0,0,0,0,0,0,0,0,0,0,0,0
86,they were obviously trying to kill alot of people,0,0,0,1,0,0,0,0,0,0,0,0,0,0,0,0,0,0,0,0,0,0,0,0,0,0
87,THEY WERE TRYING TO DESTROY THE WHITE HOUSE AND THAT AREA AND TO KILL THE pres,0,0,0,0,0,0,0,0,0,0,1,0,0,0,0,1,0,0,0,0,0,0,0,0,0,0
88,they were trying to damage or ruin the us infractstructure such as commerce & defense and they were trying to strike fear in the us people,1,0,0,0,0,0,1,0,0,1,0,0,0,0,0,0,0,0,0,0,0,0,0,0,0,0
89,"TO DESTROY//THE US//THE TERRORIST WERE ANGRY AT OUR GOVT BCAUSE THEY HAD PRISONERS THEY WANTED RELEASED,",0,0,0,0,0,0,1,0,0,0,0,0,0,0,0,0,0,0,1,0,0,0,1,0,0,0
90,"THEY WERE BEING IDIOTS, TO HURT OTHERS AND THEMSELVES",0,1,0,0,0,0,0,0,0,0,0,0,0,0,0,0,0,0,0,0,0,0,1,0,0,0
92,they can attack at any time and show us we would not be prepared at any time.,0,0,0,0,1,0,0,0,0,0,0,0,0,0,0,0,0,0,0,0,0,0,0,0,0,0
93,send a mssg that they don't  approve of western culture,0,0,0,0,0,0,0,0,0,0,0,0,0,0,0,0,0,0,1,0,0,0,0,0,0,0
94,to keep us out of their lives,0,0,0,0,0,0,0,0,0,0,0,1,0,0,0,0,0,0,0,0,0,0,0,0,0,0
95,"to get our attention on what damage they can do to us, revenge",0,0,0,0,1,0,0,0,0,0,0,0,1,0,0,0,0,0,0,0,0,0,0,0,0,0
96,i have no idea,0,0,0,0,0,0,0,0,0,0,0,0,0,0,0,0,0,0,0,0,0,0,0,0,1,0
98,POWER AND CONTROL,0,0,0,0,1,0,0,0,0,0,0,0,0,0,0,0,0,0,0,0,0,0,0,0,0,0
99,"they were trying to make a statement//aginst america because of our free democracy and christian views, big statement against our views",0,0,0,0,0,0,0,0,0,0,0,0,0,0,0,0,0,0,1,1,0,0,0,0,0,0
101,"I THINK THEIR INSANE, THEY ANGRY BUT MISDIRECTED, I AM NOT SURE THEY EVEN KNEW WHAT THEY WERE DOING",0,0,0,0,0,0,0,0,0,0,0,0,0,0,0,0,1,0,1,0,0,0,1,0,0,0
103,triumph over the world,0,0,0,0,0,0,1,0,0,0,0,0,0,0,0,0,0,0,0,0,0,0,0,0,0,0
104,"some we'll never know, showing their dislike for the US and their own religious extremist reasons,",0,0,0,0,0,0,0,0,0,0,0,0,0,0,0,0,0,0,1,0,0,1,0,0,1,0
105,trying to kill people,0,0,0,1,0,0,0,0,0,0,0,0,0,0,0,0,0,0,0,0,0,0,0,0,0,0
106,cause terror,1,0,0,0,0,0,0,0,0,0,0,0,0,0,0,0,0,0,0,0,0,0,0,0,0,0
107,"Send a message to this government, i feel its a form of retaliation to this government.",0,0,0,0,0,0,0,0,0,0,0,0,1,0,0,0,0,0,0,1,0,0,0,0,0,0
108,They were just vicious people.No respect for human life or anything else or themselves.,0,0,0,0,0,0,0,0,0,0,0,0,0,0,0,0,0,0,1,0,0,0,0,0,0,0
109,Trying to score points for themselves./trying to get back and to kill afew thousand people for us trying to take over everything. we dont judt stay in US we have to go everywhere else./,0,0,0,1,1,0,0,0,0,0,0,1,1,0,0,0,0,0,0,0,0,0,0,0,0,0
110,hatered towards democracy/capitalists,0,0,0,0,0,0,0,0,0,0,0,0,0,0,0,0,0,0,1,0,0,0,0,0,0,0
111,they were trying to tell the US to stay out of their countries./To show that they also have power./,0,0,0,0,1,0,0,0,0,0,0,1,0,0,0,0,0,0,0,0,0,0,0,0,0,0
112,intimidation regarding power of what country has more power over other countries.Power struggle between countries.,1,0,0,0,1,0,0,0,0,0,0,0,0,0,0,0,0,0,0,0,0,0,0,0,0,0
113,"They werent accomplishing anything, they were destroying the buildings because they dont like anyone here in the United States.",0,0,0,0,0,0,0,0,0,0,0,0,0,1,0,0,0,0,1,0,0,0,1,0,0,0
114,Pose a danger to the united States,0,0,0,0,1,0,0,0,0,0,0,0,0,0,0,0,0,0,0,0,0,0,0,0,0,0
115,they knew the US depends on the twin towers that they were the most important thing to the US.//they destroyed one of the most important things to us and everything has gone downhill since then.//,0,0,0,0,0,0,1,0,0,0,0,0,0,1,1,0,0,0,0,0,0,0,0,0,0,0
116,"They were trying to point out our vulnaribility and by choosing sights they picked, world trade center & Pentagon they were trying to hit key/important sights for us./They wanted to make as big of an impact and cause as big of a damage they could./",0,0,0,0,1,0,0,0,0,0,1,0,0,1,1,0,0,0,0,0,0,0,1,0,0,0
117,they just wanted to kill people in the United States,0,0,0,1,0,0,0,0,0,0,0,0,0,0,0,0,0,0,0,0,0,0,0,0,0,0
118,TRYING TO GET AMERICA'S ATTENTION TO LET THEM KNOW THEY ARE NOT AS POWERFUL AS THEY THINK THEY ARE// THEY WERE TIRED OF US TAKING CONTROL,0,0,0,0,1,0,0,0,0,0,0,0,0,0,0,0,0,0,1,1,0,0,0,0,0,0
119,they were trying to accomplish to leave their country alone,0,0,0,0,0,0,0,0,0,0,0,1,0,0,0,0,0,0,0,0,0,0,0,0,0,0
120,to destroy the united states,0,0,0,0,0,0,1,0,0,0,0,0,0,0,0,0,0,0,0,0,0,0,0,0,0,0
121,i really don't know,0,0,0,0,0,0,0,0,0,0,0,0,0,0,0,0,0,0,0,0,0,0,0,0,1,0
122,i think they were just trying to-it was more for publiclity/i think they were just trying to demonstrate what they were capable of doing/,0,0,0,0,1,0,0,0,0,0,0,0,0,0,0,0,0,0,0,1,0,0,0,0,0,0
123,harm the govt//,0,0,0,0,0,0,0,0,0,0,1,0,0,0,0,0,0,0,0,0,0,0,0,0,0,0
124,notarity - they were calling attention to themselves and their organization and beliefs. /a protest if you will/,0,0,0,0,0,0,0,0,0,0,0,0,0,0,0,0,0,0,1,1,0,0,0,0,0,0
125,"showing that terrorist are well active and that they really hate america and the west, they know muslims are the only ones that will be left standing",0,0,0,0,1,0,0,0,0,0,0,0,0,0,0,0,0,0,1,0,0,1,0,0,0,0
126,they each wanted forty virgins,0,0,0,0,0,0,0,0,0,0,0,0,0,0,0,0,0,0,0,0,0,1,0,0,0,0
127,they were trying to destroy the white house and bring down this country.,0,0,0,0,0,0,1,0,0,0,1,0,0,0,0,0,0,0,0,0,0,0,0,0,0,0
128,fear,1,0,0,0,0,0,0,0,0,0,0,0,0,0,0,0,0,0,0,0,0,0,0,0,0,0
129,they were making a political statement.,0,0,0,0,0,0,0,0,0,0,0,0,0,0,0,0,0,0,0,1,0,0,0,0,0,0
130,fear //,1,0,0,0,0,0,0,0,0,0,0,0,0,0,0,0,0,0,0,0,0,0,0,0,0,0
131,to send a message to the u.s. gov about globalizing the middle eastern countries and dealing with the israli conflict,0,0,0,0,0,0,0,0,0,0,0,1,0,0,0,0,0,0,0,0,0,0,0,0,0,0
132,to get attention to their cause.,0,0,0,0,0,0,0,0,0,0,0,0,0,0,0,0,0,0,0,1,0,0,0,0,0,0
133,take down our gov,0,0,0,0,0,0,0,0,0,0,1,0,0,0,0,0,0,0,0,0,0,0,0,0,0,0
134,sending a message that we are touchable and volnurable.,0,0,0,0,1,0,0,0,0,0,0,0,0,0,0,0,0,0,0,0,0,0,0,0,0,0
135,strike fear in america,1,0,0,0,0,0,0,0,0,0,0,0,0,0,0,0,0,0,0,0,0,0,0,0,0,0
137,fear //,1,0,0,0,0,0,0,0,0,0,0,0,0,0,0,0,0,0,0,0,0,0,0,0,0,0
138,fear,1,0,0,0,0,0,0,0,0,0,0,0,0,0,0,0,0,0,0,0,0,0,0,0,0,0
139,disrupt the u.s. ecomony.  they were fulfilling their muslim beleif the we are the infedels.  they believe they should be rulling the earth.,0,0,0,0,1,0,0,0,0,1,0,0,0,0,0,0,0,0,0,0,0,1,0,0,0,0
141,they were trying to put a dent in our financial system and show that they are enovative in how they are going to attack us. // also to start a war and to kick it up a notch. //,0,0,0,0,0,1,1,0,0,1,0,0,0,0,0,0,0,0,0,1,0,0,0,0,0,0
144,to scare us and to lower our moral by causing fear.,1,0,0,0,0,0,0,0,1,0,0,0,0,0,0,0,0,0,0,0,0,0,0,0,0,0
145,trying to show us they can hurt us in ways we never expected.,0,0,0,0,1,0,0,0,0,0,0,0,0,0,0,0,0,0,0,0,0,0,0,0,0,0
146,make a statement that america will be held accountable for our behavior around the world.,0,0,0,0,0,0,0,0,0,0,0,1,0,0,0,0,0,0,0,0,0,0,0,0,0,0
147,trying to kill americans,0,0,0,1,0,0,0,0,0,0,0,0,0,0,0,0,0,0,0,0,0,0,0,0,0,0
148,to disrupt the economy,0,0,0,0,0,0,0,0,0,1,0,0,0,0,0,0,0,0,0,0,0,0,0,0,0,0
149,i don't know if they were terrorists or not.,0,0,0,0,0,0,0,0,0,0,0,0,0,0,0,0,0,0,0,0,0,0,1,0,0,0
150,disrupt the economy,0,0,0,0,0,0,0,0,0,1,0,0,0,0,0,0,0,0,0,0,0,0,0,0,0,0
151,fear,1,0,0,0,0,0,0,0,0,0,0,0,0,0,0,0,0,0,0,0,0,0,0,0,0,0
152,killing of innocent lives and causing economic harm,0,0,0,1,0,0,0,0,0,1,0,0,0,0,0,0,0,0,0,0,0,0,0,0,0,0
153,distruction chaos,0,0,1,0,0,0,1,0,0,0,0,0,0,0,0,0,0,0,0,0,0,0,0,0,0,0
155,trying to prove that we were weak and defensless to what they plan on doing to us.,0,0,0,0,1,0,0,0,0,0,0,0,0,0,0,0,0,0,0,0,0,0,0,0,0,0
156,to get america on it's knees. to show that we are not invalable.,0,0,0,0,1,0,1,0,0,0,0,0,0,0,0,0,0,0,0,0,0,0,0,0,0,0
157,cripple our economy,0,0,0,0,0,0,0,0,0,1,0,0,0,0,0,0,0,0,0,0,0,0,0,0,0,0
158,to show their hatred towards the U.S,0,0,0,0,0,0,0,0,0,0,0,0,0,0,0,0,0,0,1,0,0,0,0,0,0,0
160,they were try to scare american people and take down our goverment,1,0,0,0,0,0,0,0,0,0,1,0,0,0,0,0,0,0,0,0,0,0,0,0,0,0
161,trying to make a statement,0,0,0,0,0,0,0,0,0,0,0,0,0,0,0,0,0,0,0,1,0,0,0,0,0,0
162,try to incite fear in the US//,1,0,0,0,0,0,0,0,0,0,0,0,0,0,0,0,0,0,0,0,0,0,0,0,0,0
163,no ideal,0,0,0,0,0,0,0,0,0,0,0,0,0,0,0,0,0,0,0,0,0,0,0,0,1,0
164,to show the government that we are not strong enough to prevent bad things happening to our country,0,0,0,0,1,0,0,0,0,0,0,0,0,0,0,0,0,0,0,0,0,0,0,0,0,0
165,to fear them,1,0,0,0,0,0,0,0,0,0,0,0,0,0,0,0,0,0,0,0,0,0,0,0,0,0
166,fear-they were trying to demonstrate their power.let americans know that they are not safe. we are living in a false sense of security. Also showed they are very smart people by their choice of actions.,1,0,0,0,1,0,0,0,0,0,0,0,0,0,0,0,0,0,0,0,0,0,0,0,0,0
167,"they were just out to get us, i don't know exactly why, trying to kill alot of people",0,0,0,1,0,0,1,0,0,0,0,0,0,0,0,0,0,0,0,0,0,0,0,0,1,0
168,<DK>,0,0,0,0,0,0,0,0,0,0,0,0,0,0,0,0,0,0,0,0,0,0,0,0,1,0
169,dk,0,0,0,0,0,0,0,0,0,0,0,0,0,0,0,0,0,0,0,0,0,0,0,0,1,0
170,<DK>,0,0,0,0,0,0,0,0,0,0,0,0,0,0,0,0,0,0,0,0,0,0,0,0,1,0
171,\,0,0,0,0,0,0,0,0,0,0,0,0,0,0,0,0,0,0,0,0,0,0,0,0,0,1
172,destroy our country,0,0,0,0,0,0,1,0,0,0,0,0,0,0,0,0,0,0,0,0,0,0,0,0,0,0
173,called the atention of the a USA to leave his people in peace,0,0,0,0,0,0,0,0,0,0,0,1,0,0,0,0,0,0,0,0,0,0,0,0,0,0
174,intimidation//they were trying to impose their religion on us//no,1,0,0,0,0,0,0,0,0,0,0,0,0,0,0,0,0,0,0,0,0,1,0,0,0,1
175,to let the world know that the US is not the leader and not the strongest country in the world. we have a complacency in our power and think that no one can humble us,0,0,0,0,1,0,0,0,0,0,0,0,0,0,0,0,0,0,0,0,0,0,0,1,0,0
176,trying to prove tht they could penetrate and hurt people of the USA and control some situations and a surprise attack showed that we were not on guard and did not have the security that we should have had,0,1,0,0,1,0,0,0,0,0,0,0,0,0,0,0,0,0,0,0,0,0,0,0,0,0
177,compromise the security of the US//no,0,0,0,0,1,0,0,0,0,0,0,0,0,0,0,0,0,0,0,0,0,0,0,0,0,1
178,killing Americans because they hate them//their religion//they are jealous of American//no,0,0,0,1,0,0,0,0,0,0,0,0,0,0,0,0,0,1,1,0,0,1,0,0,0,1
179,they were trying to impact the financial power of the US,0,0,0,0,0,0,0,0,0,1,0,0,0,0,0,0,0,0,0,0,0,0,0,0,0,0
180,trying to hurt the great satan where it hurts,0,1,0,0,0,0,0,0,0,0,0,0,0,0,0,0,0,0,0,0,0,1,0,0,0,0
181,attempt to overthrow the gov't,0,0,0,0,0,0,0,0,0,0,1,0,0,0,0,0,0,0,0,0,0,0,0,0,0,0
182,they hate our freedoms and they think we are infidels//jealously//has to do with their God//they think American belongs to Satan in their eyes//no,0,0,0,0,0,0,0,0,0,0,0,0,0,0,0,0,0,1,1,0,0,1,0,0,0,1
183,"trying to , it hink it was a tool to recruit more peole and to start a war, i think they wanted to start a war, most people know that the bush's had ties with alquaida and the saudia arabia, and i think something went wrong, i still don't understand why g bush flew back bin laden relatives back to the middle east that were living in america, i believe it is alot more than what we know//we used to sell them weapons, the waspons they have were from us , the first pres bush was actually, i wouldn't say friends but associates of each other, i beleive the gwbush, the small bush, wanted to finish what the older bush started, i think there is so much more that we don't know about, i think that is why we never found wmd's and still haven't caugght bin ladin, i also think oil had something to do with it",0,0,0,0,0,1,0,0,0,0,0,0,0,0,0,0,0,0,0,0,0,0,1,1,0,0
184,"i think they probably wanted  the US to know who they were messing with , like a wake-up call, like a warning like to stay out of our business//no",0,0,0,0,1,0,0,0,0,0,0,1,0,0,0,0,0,0,0,0,0,0,0,0,0,1
185,power,0,0,0,0,1,0,0,0,0,0,0,0,0,0,0,0,0,0,0,0,0,0,0,0,0,0
186,fear,1,0,0,0,0,0,0,0,0,0,0,0,0,0,0,0,0,0,0,0,0,0,0,0,0,0
187,"its a damn good question, killing themselves//create a war and allow bush to use his tanks and shit// putting more restrictions on the public, you can't take a lighter  on an airplane , the doors should be closed and locked after the pilot gets in",0,0,0,0,0,1,0,0,0,0,0,0,0,0,0,0,0,0,0,0,0,0,1,1,0,0
188,i believe our administration allowed the them to enter our airspace and strike us and their motive would be a reaction to US involvement in other countries.,0,0,0,0,0,0,0,0,0,0,0,1,0,0,0,0,0,0,0,0,0,0,1,0,0,0
189,call attention to their cause,0,0,0,0,0,0,0,0,0,0,0,0,0,0,0,0,0,0,0,1,0,0,0,0,0,0
190,"just to attack and destroy a well known building, to hurt the us basically , to see what // to see how powerful they really are, // by they you mean the terrorists? yes//no",0,1,0,0,1,0,0,0,0,0,0,0,0,1,0,0,0,0,0,0,0,0,0,0,0,1
192,kill people and disrupt the economy,0,0,0,1,0,0,0,0,0,1,0,0,0,0,0,0,0,0,0,0,0,0,0,0,0,0
193,murder,0,0,0,1,0,0,0,0,0,0,0,0,0,0,0,0,0,0,0,0,0,0,0,0,0,0
194,They were really trying to get back to the U.S. for what we had done to their countries. Kinda of an eye for eye.,0,0,0,0,0,0,0,0,0,0,0,0,1,0,0,0,0,0,0,0,0,0,0,0,0,0
195,killing people-sucide on their behalf and killing as many american people as tehy could-dont know why.,0,0,0,1,0,0,0,0,0,0,0,0,0,0,0,0,0,0,0,0,0,0,1,0,1,0
196,punshing them,0,0,0,0,0,0,0,0,0,0,0,0,1,0,0,0,0,0,0,0,0,0,0,0,0,0
197,atack the us goverment,0,0,0,0,0,0,0,0,0,0,1,0,0,0,0,0,0,0,0,0,0,0,0,0,0,0
198,"trying to cause chaos in the US, economic chaos, with the world trade center, and fear, they hate our western style culture, our democracy, our vlaues, our freedoms, they are scared we are going to put our values on them regarding women's rights, they think we are being imperialsistic, influencing the middle east, they didn't think we would retaliate, they thought we were w weak nation with no resolve to hit them back, but we did have the resolv eto fight back, its a reliously based war",1,0,1,0,1,1,0,0,0,1,0,1,0,1,0,0,0,0,1,0,0,1,1,1,0,0
199,"chaois/dividing america, causing turmiol within the givenment and the people",0,0,1,0,0,0,1,0,0,0,0,0,0,0,0,0,0,0,0,0,0,0,0,0,0,0
200,I think they were to show George W.  Bush personally how honorable he was in foreign affairs and the backing of Israel and targeting him personaaloy.,0,0,0,0,0,0,0,0,0,0,0,1,0,0,0,1,0,0,0,0,0,0,0,0,0,0
201,i think they were trying to accomplish their job obvoiusly to make their act of human nature and to wreck the american people and their own crooked ways//no,0,0,0,0,0,0,1,0,0,0,0,0,0,0,0,0,0,0,0,0,0,0,1,0,0,1
202,i think this goes back to biblical days and i think it coes back down to muslims vs chroistians and our way of living and it coes down to biblical beliefs,0,0,0,0,0,0,0,0,0,0,0,0,0,0,0,0,0,0,0,0,0,1,0,0,0,0
203,"to knock us down a notch , to kill as many people as they could, to try to prove that they are more powerful and smarter//",0,0,0,1,1,0,0,0,0,0,0,0,0,0,0,0,0,0,0,0,0,0,0,0,0,0
204,"i tink it was a couple of things they wanted to kill american, they wanted to prove a point that they could evade our territory and i think they wanted to cripple us financially/ao",0,0,0,1,1,0,0,0,0,1,0,0,0,0,0,0,0,0,0,0,0,0,0,1,0,1
205,they wanted to destroy our economy//and carry out a religious war against western civilization//they wanted to punish america for being involved in middle eastern affairs//no,0,0,0,0,0,1,0,0,1,1,0,1,1,0,0,0,0,0,0,0,0,0,0,0,0,1
206,destruir el gobierno//cause terror//no,1,0,0,0,0,0,0,0,0,0,1,0,0,0,0,0,0,0,0,0,0,0,0,0,0,1
207,"recognition, their dislike of our, what they consider our teronly to their country and beliefs",0,0,0,0,0,0,0,0,0,0,0,0,0,0,0,0,0,0,1,1,0,0,0,0,0,0
208,"i think they were trying to prove to us what they could do otherwordshow vulnerable we really are to their attacks, they came right in and created havoc look how many people lost their lives and they told us they were going to do this and that and then they did it, they caught us completily off guard//no",0,0,1,1,1,0,1,0,0,0,0,0,0,0,0,0,0,0,0,0,0,0,0,0,0,1
