412,spread terror make people afraid//no,1,0,0,0,0,0,0,0,0,0,0,0,0,0,0,0,0,0,0,0,0,0,0,0,0,1
413,"get back at us for being involved in everyone's business//show of force, let us know we are not super power, bring ego down a notch//no",0,0,0,0,1,0,0,0,0,0,0,1,1,0,0,0,0,0,0,0,0,0,0,0,0,1
414,"I think they were trying to frighten the US, show power//no",1,0,0,0,1,0,0,0,0,0,0,0,0,0,0,0,0,0,0,0,0,0,0,0,0,1
415,"trying to kill off the big dogs so they could take over//just to prove a point that athey could do it and get away with it, because they are stupid?//",0,0,0,1,1,0,1,0,0,0,0,0,0,0,0,0,0,0,0,0,0,0,1,0,0,0
416,trreaten people's lives and the ecomony//hurt the government//no,1,0,0,0,0,0,0,0,0,1,1,0,0,0,0,0,0,0,0,0,0,0,0,0,0,1
417,killing a lot of people to get a point across//no,0,0,0,1,1,0,0,0,0,0,0,0,0,0,0,0,0,0,0,0,0,0,0,0,0,1
418,trying to get back at the government//,0,0,0,0,0,0,0,0,0,0,0,0,1,0,0,0,0,0,0,0,0,0,0,0,0,0
420,fear in the american people//,1,0,0,0,0,0,0,0,0,0,0,0,0,0,0,0,0,0,0,0,0,0,0,0,0,0
421,"they all wanted 82 virgins, I think they wanted to say, hey look at me, take me seriously, you think youre invulerable but you're not//no",0,0,0,0,1,0,0,0,0,0,0,0,0,0,0,0,0,0,0,1,0,1,0,0,0,1
422,i DON'T KNOW//i DON'T KNOW,0,0,0,0,0,0,0,0,0,0,0,0,0,0,0,0,0,0,0,0,0,0,0,0,1,0
423,they wanted Americns to realize their thoughts and be aware of where we fit into the world//,0,0,0,0,1,0,0,0,0,0,0,0,0,0,0,0,0,0,0,1,0,0,0,0,0,0
424,their ultimate goal is to destroy western civilization//in particular they were trying to disrupt the US government//and kill Americans//,0,0,0,1,0,0,0,0,1,0,1,0,0,0,0,0,0,0,0,0,0,0,0,0,0,0
425,striking fear//making themselves known//hurting America and following their religion,1,1,0,0,0,0,0,0,0,0,0,0,0,0,0,0,0,0,0,1,0,1,0,0,0,0
426,I think they were trying to put frear into the american public and to destroy our economy//to kill as many americans as they could,1,0,0,1,0,0,0,0,0,1,0,0,0,0,0,0,0,0,0,0,0,0,0,0,0,0
427,mainly the vulnerability of the US//,0,0,0,0,1,0,0,0,0,0,0,0,0,0,0,0,0,0,0,0,0,0,0,0,0,0
428,just  to destabilize our country//invoke terror//,1,0,0,0,0,0,1,0,0,0,0,0,0,0,0,0,0,0,0,0,0,0,0,0,0,0
429,"dk for sure, just don't have any idea//probably trying to invade our country//",0,0,0,0,0,0,1,0,0,0,0,0,0,0,0,0,0,0,0,0,0,0,0,0,1,0
430,to send a message about their beliefs//maybe trying to make people realize that America is not untouchable//,0,0,0,0,1,0,0,0,0,0,0,0,0,0,0,0,0,0,0,0,0,1,0,0,0,0
431,"they were trying to make a point, trying to get to heaven//did they try to destroy anything?  Any evidence or trail of something not being found somewhere else, information backup systems in the country are unbelieveable",0,0,0,0,0,0,0,0,0,0,0,0,0,0,0,0,0,0,0,1,0,1,1,1,0,0
432,"I think they were declaring war on the United States, Muslims, the way they think, I think they wre delaring war against the Christian world.  We jsut haven't grasped it, we don't understand that the war is on",0,0,0,0,0,1,0,0,0,0,0,0,0,0,0,0,0,0,0,0,0,1,0,1,0,0
433,"to show that they ain't playing no games, must have done something bad for them to attack us like that, they must have been really furious, I dk what they wanted to prove//",0,0,0,0,1,0,0,0,0,0,0,0,1,0,0,0,0,0,1,0,0,0,0,0,1,0
434,bother the US,0,0,0,0,0,0,1,0,0,0,0,0,0,0,0,0,0,0,0,0,0,0,0,0,0,0
435,"probalby scaring the hell out of us, they weren't alive long enough to tell us what they wanted//possibly to make a statement against the US, but what, we never heard//against the world trade commision is what I heard,//no",1,0,0,0,0,0,0,0,0,0,0,0,0,0,0,0,0,0,1,0,0,0,1,0,0,1
436,to wipe out our country//just to wipe us out,0,0,0,0,0,0,1,0,0,0,0,0,0,0,0,0,0,0,0,0,0,0,0,0,0,0
437,they were trying to bring us down//like they don't want us to be better off than they are//they were trying to break our economy maybe//,0,0,0,0,0,0,1,0,0,1,0,0,0,0,0,0,0,1,0,0,0,0,0,0,0,0
438,"I guess they wre trying to take over the US, I'm not sure",0,0,0,0,0,0,1,0,0,0,0,0,0,0,0,0,0,0,0,0,0,0,0,0,1,0
439,"I think they did it because they didn't want the us government having anything to do with their country//trying to make a statement to the US government like don't mess with us because we're not afrain, trying to tell the US government that they're willing to do anytinhg to show the government that they can beat the US govrnment//",0,0,0,0,1,0,0,0,0,0,0,1,0,0,0,0,0,0,0,0,0,0,0,0,0,0
440,"just to show that they can actually do it, that it's not hard to do it//",0,0,0,0,1,0,0,0,0,0,0,0,0,0,0,0,0,0,0,0,0,0,0,0,0,0
441,"to get back at the Americans as a country//I think they felt that the Americans had done an injustice to them, and to get revenge//I know they put fear into the country, but I don't know if that is what they were trying to accomplish, they were trying to kill as many people as possible//",1,0,0,1,0,0,0,0,0,0,0,0,1,0,0,0,0,0,0,0,0,0,0,0,1,0
442,it was just a bad thing.  they didnt try to do anything reasonable by killing all those people.,0,0,0,1,0,0,0,0,0,0,0,0,0,0,0,0,1,0,0,0,0,0,1,0,0,0
443,weaken our government?//make us afraid//,1,0,0,0,0,0,0,0,0,0,1,0,0,0,0,0,0,0,0,0,0,0,0,0,0,0
444,dk//just trying ...dk/,0,0,0,0,0,0,0,0,0,0,0,0,0,0,0,0,0,0,0,0,0,0,0,0,1,0
446,Cause chaos in the strongest biggest democratic country in the world//,0,0,1,0,0,0,0,0,0,0,0,0,0,0,0,0,0,0,0,0,0,0,0,0,0,0
447,"Jihad,//I thin they wanted to kill americans//I think they wanted to prove that american is not as safe as we always thoughts//",0,0,0,1,1,0,0,0,0,0,0,0,0,0,0,0,0,0,0,0,0,1,0,0,0,0
448,"prove that they were stronger than us//they probably thought they were going to kill lmore people than they did, and they didn't succeed//no",0,0,0,1,1,0,0,0,0,0,0,0,0,0,0,0,0,0,0,0,0,0,1,0,0,1
449,trying to make a statement about how they were not happy with the US and trying to stir up some kind of controveersy or conflict so we would get into a confrontation with them//no,0,0,1,0,0,1,0,0,0,0,0,0,0,0,0,0,0,0,1,0,0,0,0,0,0,1
450,"they were trying to make a statement//about how vulerable america can be and that we can't always get everything right, and obviously different views too//",0,0,0,0,1,0,0,0,0,0,0,0,0,0,0,0,0,0,0,1,0,0,0,0,0,0
451,destroy the hope of americans today//no,0,0,0,0,0,0,0,0,1,0,0,0,0,0,0,0,0,0,0,0,0,0,0,0,0,1
453,"to kill as many people as possible, and to effect negatively our economy. to instill fear in the citizens of the United States.  To create an animosity towards the US by showing citizens that terrorists can effect our society.",1,0,1,1,1,0,0,0,0,1,0,0,0,0,0,0,0,0,0,0,0,0,0,0,0,0
454,"I think they're hate mongering, I can't understand it to the point to really explain more.",0,0,0,0,0,0,0,0,0,0,0,0,0,0,0,0,0,0,1,0,0,0,0,0,1,0
455,get our attention\\ warn us of their strength and visability\\ to hurt us\\no,0,1,0,0,1,0,0,0,0,0,0,0,0,0,0,0,0,0,0,1,0,0,0,0,0,1
456,trying to destroy the united states,0,0,0,0,0,0,1,0,0,0,0,0,0,0,0,0,0,0,0,0,0,0,0,0,0,0
457,trying to the attention of our government\\no,0,0,0,0,0,0,0,0,0,0,0,0,0,0,0,0,0,0,0,1,0,0,0,0,0,1
458,i'm not sure.,0,0,0,0,0,0,0,0,0,0,0,0,0,0,0,0,0,0,0,0,0,0,0,0,1,0
459,To intimidate the US.//no,1,0,0,0,0,0,0,0,0,0,0,0,0,0,0,0,0,0,0,0,0,0,0,0,0,1
460,They wanted to destroy everything and start a war.,0,0,0,0,0,1,1,0,0,0,0,0,0,0,0,0,0,0,0,0,0,0,0,0,0,0
461,Terror against the United States.//no,1,0,0,0,0,0,0,0,0,0,0,0,0,0,0,0,0,0,0,0,0,0,0,0,0,1
462,"trying to commit an act of bombing on us soil on a large scale, this has not been forgotten\\no",0,0,0,0,0,0,1,0,0,0,0,0,0,0,0,0,0,0,0,0,0,0,1,0,0,1
463,to get mor attention for things they want for their country//no,0,0,0,0,0,0,0,0,0,0,0,0,0,0,0,0,0,0,0,1,0,0,0,0,0,1
464,"other than killing a large number of people, they were trying to prove that america is vulnerable to being attacked.",0,0,0,1,1,0,0,0,0,0,0,0,0,0,0,0,0,0,0,0,0,0,0,0,0,0
466,hurt of economy.//no,0,0,0,0,0,0,0,0,0,1,0,0,0,0,0,0,0,0,0,0,0,0,0,0,0,1
467,to show that the US is vulnerable.//and to show they're hatred towards the US.//no.,0,0,0,0,1,0,0,0,0,0,0,0,0,0,0,0,0,0,1,0,0,0,0,0,0,1
470,"they're trying to scare everybody, so that they can gain power over us.//no",1,0,0,0,1,0,0,0,0,0,0,0,0,0,0,0,0,0,0,0,0,0,0,0,0,1
471,"trying to scare the US, that they could be beat like other countries could.//that countries like Iran most of them are Muslims, and they hate white people they want to destroy them all.//no",1,0,0,0,1,0,1,0,0,0,0,0,0,0,0,0,0,0,1,0,0,1,0,0,0,1
472,"they just didn't like us, not because of what we stood for, they just don't like us. alot of americans go over there and they're very arrogant.",0,0,0,0,0,0,0,0,0,0,0,1,0,0,0,0,0,0,1,0,0,0,1,0,0,0
473,"i think mostly they were trying to be heard, but that was the wrong to do, but i guess those people are crazy.//they were trying to prove something, that the middle east was not treated fairly.//no",0,0,0,0,0,0,0,0,0,0,0,1,0,0,0,0,1,0,0,1,0,0,1,0,0,1
475,"they were trying to let us know that we're not untouchable, that they can attack us on our own soil.//no",0,0,0,0,1,0,0,0,0,0,0,0,0,0,0,0,0,0,0,0,0,0,0,0,0,1
476,they were trying to destroy this country.//no,0,0,0,0,0,0,1,0,0,0,0,0,0,0,0,0,0,0,0,0,0,0,0,0,0,1
477,"trying to get the money, and trying to control our country.//no",0,0,0,0,0,0,1,0,0,0,0,0,0,0,0,0,0,0,0,0,0,0,1,0,0,1
478,i don't think it was terrorists.//no,0,0,0,0,0,0,0,0,0,0,0,0,0,0,0,0,0,0,0,0,0,0,1,0,0,1
479,"they were trying to kill all those people and make a statement, that they don't care and that they're going to kill everyone of us.",0,0,0,1,0,0,0,0,0,0,0,0,0,0,0,0,0,0,1,1,0,0,0,0,0,0
480,"I think they're just trying to get George Bush, because of what he did.  Because of the war.",0,0,0,0,0,0,0,0,0,0,0,0,1,0,0,1,0,0,0,0,0,0,0,0,0,0
481,they were striking  back at US for trying to force our way on them,0,0,0,0,0,0,0,0,0,0,0,1,1,0,0,0,0,0,0,0,0,0,0,0,0,0
482,"they want attention, to be noticed",0,0,0,0,0,0,0,0,0,0,0,0,0,0,0,0,0,0,0,1,0,0,0,0,0,0
483,stop the flow of money from overseas or wherever it comes from,0,0,0,0,0,0,0,0,0,1,0,0,0,0,0,0,0,0,0,0,0,0,0,0,0,0
484,to use civilians in u.s. to prove a point,0,0,0,0,1,0,0,0,0,0,0,0,0,0,0,0,0,0,0,0,0,0,0,0,0,0
485,frighten and intimidate,1,0,0,0,0,0,0,0,0,0,0,0,0,0,0,0,0,0,0,0,0,0,0,0,0,0
487,to scare the heck out of the president,1,0,0,0,0,0,0,0,0,0,0,0,0,0,0,0,0,0,0,0,0,0,0,0,0,0
488,to scare america,1,0,0,0,0,0,0,0,0,0,0,0,0,0,0,0,0,0,0,0,0,0,0,0,0,0
489,start a war,0,0,0,0,0,1,0,0,0,0,0,0,0,0,0,0,0,0,0,0,0,0,0,0,0,0
490,trying to push their religion onto us,0,0,0,0,0,0,0,0,0,0,0,0,0,0,0,0,0,0,0,0,0,1,0,0,0,0
491,don't know,0,0,0,0,0,0,0,0,0,0,0,0,0,0,0,0,0,0,0,0,0,0,0,0,1,0
492,to gain respect for their countries & keep the US out of their business,0,0,0,0,0,0,0,0,0,0,0,1,0,0,0,0,0,0,0,1,0,0,0,0,0,0
493,i never understood what,0,0,0,0,0,0,0,0,0,0,0,0,0,0,0,0,0,0,0,0,0,0,0,0,1,0
494,to harm america,0,0,0,0,0,0,1,0,0,0,0,0,0,0,0,0,0,0,0,0,0,0,0,0,0,0
495,frighten us to death,1,0,0,0,0,0,0,0,0,0,0,0,0,0,0,0,0,0,0,0,0,0,0,0,0,0
496,holocaust,0,0,0,1,0,0,0,0,0,0,0,0,0,0,0,0,0,0,0,0,0,0,0,0,0,0
497,i don't know//who knows the true story behind that,0,0,0,0,0,0,0,0,0,0,0,0,0,0,0,0,0,0,0,0,0,0,0,0,1,0
498,trying to take over,0,0,0,0,0,0,1,0,0,0,0,0,0,0,0,0,0,0,0,0,0,0,0,0,0,0
499,<DK>,0,0,0,0,0,0,0,0,0,0,0,0,0,0,0,0,0,0,0,0,0,0,0,0,1,0
500,R does not know (does not want to do this),0,0,0,0,0,0,0,0,0,0,0,0,0,0,0,0,0,0,0,0,0,0,0,0,1,1
501,KILL & ROB THEM,0,0,0,1,0,0,0,0,0,0,0,0,0,0,0,0,0,0,0,0,0,0,1,0,0,0
502,making a statement to George Bush about the oil,0,0,0,0,0,0,0,0,0,0,0,1,0,0,0,0,0,0,0,0,0,0,0,0,0,0
503,SCREW THE us ECONOMY AND KIILL AMERICANS,0,0,0,1,0,0,0,0,0,1,0,0,0,0,0,0,0,0,0,0,0,0,0,0,0,0
504,SEND A MESSAGE THAT HTEY CAN DO WHATEVER THEY WANT TO DO.  SENT TO us,0,0,0,0,1,0,0,0,0,0,0,0,0,0,0,0,0,0,0,0,0,0,0,0,0,0
505,THEY  WERE CRAZY//TRYING TO MAKE US BELIEVE WHAT THEY BELIEVE (COMMUNISTS)//THEY WERE TRYING TO FORCE US TO THEIR WAY OF THINKING,0,0,0,0,0,0,0,0,1,0,0,0,0,0,0,0,1,0,0,0,0,0,0,0,0,0
506,trying to start a war,0,0,0,0,0,1,0,0,0,0,0,0,0,0,0,0,0,0,0,0,0,0,0,0,0,0
508,get back at Bush,0,0,0,0,0,0,0,0,0,0,0,0,1,0,0,0,0,0,0,0,0,0,0,0,0,0
509,nothing//they killed everybody//they were just trying to kill people and the president//tear up the world//no,0,0,0,1,0,0,1,0,0,0,0,0,0,0,0,1,0,0,0,0,0,0,0,0,0,1
510,trying to get back at the Bushes//  tear down the trade center and this was a good time because bush was off reading somewhere,0,0,0,0,0,0,0,0,0,0,0,0,1,1,0,0,0,0,0,0,0,0,1,0,0,0
511,does not know,0,0,0,0,0,0,0,0,0,0,0,0,0,0,0,0,0,0,0,0,0,0,0,0,1,0
512,TO BE KNOWN OR TO BE HEARD//REVENGE//NO,0,0,0,0,0,0,0,0,0,0,0,0,1,0,0,0,0,0,0,1,0,0,0,0,0,1
513,doesn't know,0,0,0,0,0,0,0,0,0,0,0,0,0,0,0,0,0,0,0,0,0,0,0,0,1,0
514,"R has no idea, she has no idea what is on someone else's mind//they were following orders to kill as many people as they could because of their religious beliefs// they hate the US//",0,0,0,1,0,0,0,0,0,0,0,0,0,0,0,0,0,0,1,0,0,1,0,0,1,0
515,THEY WANTED TO HUMILLIATE THE AMERICANS//LOOKING FOR REVENGE//COBRANDO CUENTAS//STOP,0,0,0,0,1,0,0,0,0,0,0,0,1,0,0,0,0,0,0,0,0,0,0,0,0,1
516,TO GET FEAR TO THE AMERICAN PEOPLE//STOP,1,0,0,0,0,0,0,0,0,0,0,0,0,0,0,0,0,0,0,0,0,0,0,0,0,1
517,"A MESSAGE TO THE US, WHATEVER THE MESSAGE WAS, FANATICAL, ISLAM OR...// STOP",0,0,0,0,0,0,0,0,0,0,0,0,0,0,0,0,1,0,0,1,0,1,0,0,0,1
518,SCARE US//REVENGE//GET ATTENTION//STOP,1,0,0,0,0,0,0,0,0,0,0,0,1,0,0,0,0,0,0,1,0,0,0,0,0,1
519,TRYING TO KILL US CITIZENS AND TRYING TO SCARE US//TRYING TO DEVALUE OUR SYSTEM AS A DEMOCRACY//MAYBE EVEN TRYING TO WARN US//STOP,1,0,0,1,1,0,0,1,0,0,0,0,0,0,0,0,0,0,0,0,0,0,0,0,0,1
520,TRYING TO START A REVOLUTION SO THAT ISLAM COULD EVENTUALLY TAKE OVER THE WORLD AND THAT THEY COULD FULFILL THEIR RELIGIOUS PROPHESY OF AMERICANS BEING INFIDELS//TO TAKE AWAY OUR FREEDOM AND BEING CONTROLLED BY THEIR RELIGION//STOP,0,0,0,0,0,0,1,0,1,0,0,0,0,0,0,0,0,0,0,0,0,1,0,0,0,1
521,I DON'T KNOW HOW TO ANSWER TO THAT//THEY DID IT JUST TO...//SHOW... I DON'T KNOW//STOP,0,0,0,0,0,0,0,0,0,0,0,0,0,0,0,0,0,0,0,0,0,0,1,0,1,1
522,"MAKE A STATEMENT TO THE US GOVERMENT THAT THEY COULD KILL US ALL WHENEVER THEY WANT TO// FOR A GOVMT THAT IS SUPPOSED TO BE SO POWERFUL, THEY CANNOT EVEN PROTECT THEIR CITIZENS// THAT THE US IS ALWAYS VULNERABLE//STOP",0,0,0,0,1,0,0,0,0,0,0,0,0,0,0,0,0,0,0,0,0,0,0,0,0,1
523,"KILL AS MANY AMERICANS AS POSSIBLE//SEND A MESSAGE TO THE IMPERIALISTIC REGIME CALLED THE USA, THAT THEY WILL FIGHT YOU TO THE END//STOP",0,0,0,1,1,0,0,0,0,0,0,0,0,0,0,0,0,0,1,0,0,0,0,0,0,1
524,THEIR STRENGTH// THEY WANTED TO DEFEAT AMERICA// THEY ARE ALL INSANE// I HOPE WE CAN GET OUT OF THERE// I THINK WE'VE BEEN THERE LONG ENOUGH//STOP,0,0,0,0,1,0,1,0,0,0,0,1,0,0,0,0,1,0,0,0,0,0,0,0,0,1
525,JUST TO KILL AND DESTROY AND MAYBE TAKE OVER// THEY SURE HATE US//STOP,0,0,0,1,0,0,1,0,0,0,0,0,0,0,0,0,0,0,1,0,0,0,0,0,0,1
528,"tell us that a war is on, creating war.",0,0,0,0,0,1,0,0,0,0,0,0,0,0,0,0,0,0,0,0,0,0,0,0,0,0
529,instill fear and they did that.,1,0,0,0,0,0,0,0,0,0,0,0,0,0,0,0,0,0,0,0,0,0,0,0,0,0
530,send a meassage of fear and how war feels when it is on your doorstep. America done  done war at other countries but never on america's land.,1,0,0,0,0,1,0,0,0,0,0,1,1,0,0,0,0,0,0,0,0,0,0,0,0,0
531,i have thiught about that. Just to prove that they can do that.,0,0,0,0,1,0,0,0,0,0,0,0,0,0,0,0,0,0,0,0,0,0,0,0,0,0
532,um tring to take donw the us gov,0,0,0,0,0,0,0,0,0,0,1,0,0,0,0,0,0,0,0,0,0,0,0,0,0,0
533,wanted to kill a lot of people and destroy the basis of our finances and show us they a power to be reckoned with. Some thing we never thought would happen,0,0,0,1,1,0,0,0,0,1,0,0,0,0,0,0,0,0,0,0,0,0,0,0,0,0
534,warning of what was to come//no,0,0,0,0,1,0,0,0,0,0,0,0,0,0,0,0,0,0,0,0,0,0,0,0,0,1
535,wake up america.,0,0,0,0,0,0,0,0,0,0,0,0,0,0,0,0,0,0,0,1,0,0,0,0,0,0
536,"trying to invade america, trying to scare us.",1,0,0,0,0,0,1,0,0,0,0,0,0,0,0,0,0,0,0,0,0,0,0,0,0,0
537,<RF>,0,0,0,0,0,0,0,0,0,0,0,0,0,0,0,0,0,0,0,0,0,0,0,0,0,1
538,disrupt the financial trade of US for the moment. Mostly diversions,0,0,0,0,0,0,0,0,0,1,0,0,0,0,0,0,0,0,0,0,0,0,1,0,0,0
539,to hurt uss//no,0,0,0,0,0,0,1,0,0,0,0,0,0,0,0,0,0,0,0,0,0,0,0,0,0,1
540,making americans afraid,1,0,0,0,0,0,0,0,0,0,0,0,0,0,0,0,0,0,0,0,0,0,0,0,0,0
541,they was tring toshow us the they could get to us //no,0,0,0,0,1,0,0,0,0,0,0,0,0,0,0,0,0,0,0,0,0,0,0,0,0,1
543,"the terrorists have less fear of death, value life less. feel they would die for what they believe but doesnt know what they believe.",0,0,0,0,0,0,0,0,0,0,0,0,0,0,0,0,1,0,1,0,0,1,1,0,0,0
544,too show the amircana poeople what they could do tous for the hater of the us //no,0,0,0,0,1,0,0,0,0,0,0,0,0,0,0,0,0,0,1,0,0,0,0,0,0,1
545,building fear in America.,1,0,0,0,0,0,0,0,0,0,0,0,0,0,0,0,0,0,0,0,0,0,0,0,0,0
546,i realy don't know what they was triing to accompish,0,0,0,0,0,0,0,0,0,0,0,0,0,0,0,0,0,0,0,0,0,0,0,0,1,0
547,"cause death, meyam, economic and social destuction of the US",0,0,1,1,0,0,0,0,1,1,0,0,0,0,0,0,0,0,0,0,0,0,0,0,0,0
548,"send us a message to let us know that they can be a threat, not to overlook them.",0,0,0,0,1,0,0,0,0,0,0,0,0,0,0,0,0,0,0,1,0,0,0,0,0,0
549,killing to prove a point//there not afied//o,0,0,0,1,1,0,0,0,0,0,0,0,0,0,0,0,0,0,0,0,0,0,0,0,0,0
550,taking our government out.,0,0,0,0,0,0,0,0,0,0,1,0,0,0,0,0,0,0,0,0,0,0,0,0,0,0
551,thier power.,0,0,0,0,1,0,0,0,0,0,0,0,0,0,0,0,0,0,0,0,0,0,0,0,0,0
552,"to show how easy it is to get to us, shows we need to up our security.",0,0,0,0,1,0,0,0,0,0,0,0,0,0,0,0,0,0,0,0,0,0,0,0,0,0
553,"to warn them that they were stronger than we thouht, and they wanted to show us how easy it was to get to us.",0,0,0,0,1,0,0,0,0,0,0,0,0,0,0,0,0,0,0,0,0,0,0,0,0,0
554,trying send a message that the other part of the world has the power to gain control. its all about control.,0,0,0,0,1,0,0,0,0,0,0,0,0,0,0,0,0,0,0,0,0,0,0,0,0,0
555,show power and control//no,0,0,0,0,1,0,0,0,0,0,0,0,0,0,0,0,0,0,0,0,0,0,0,0,0,1
556,"I think there is a correlation between telephone no. 911 and the date. That's why they did it on 9/11, they really thought it through//no",0,0,0,0,0,0,0,0,0,0,0,0,0,0,0,0,0,0,0,0,0,0,1,0,0,1
557,"trying to scare americans and try to take over our ciutnrty, they dont like the way we run our country.",1,0,0,0,0,0,1,0,0,0,0,0,0,0,0,0,0,0,1,0,0,0,0,0,0,0
558,to show americans that they can do harm to us at anytime/no,0,0,0,0,1,0,0,0,0,0,0,0,0,0,0,0,0,0,0,0,0,0,0,0,0,1
559,exactlt what they did. attept of show of power.,0,0,0,0,1,0,0,0,0,0,0,0,0,0,0,0,0,0,0,0,0,0,1,0,0,0
560,that we had had our guard down and had no idea of what was about to happen. wish they could find bin laden,0,0,0,0,1,0,0,0,0,0,0,0,0,0,0,0,0,0,0,0,0,0,0,0,0,0
561,to destroy america,0,0,0,0,0,0,1,0,0,0,0,0,0,0,0,0,0,0,0,0,0,0,0,0,0,0
562,i have no idea,0,0,0,0,0,0,0,0,0,0,0,0,0,0,0,0,0,0,0,0,0,0,0,0,1,0
563,"i dont even now,pass on this",0,0,0,0,0,0,0,0,0,0,0,0,0,0,0,0,0,0,0,0,0,0,0,0,1,1
564,um to dis our gov//umand well tocause enanoic calap//o,0,0,0,0,0,0,0,0,0,1,1,0,0,0,0,0,0,0,0,0,0,0,0,0,0,1
565,they were tellin us they was here and trying to start a war,0,0,0,0,0,1,0,0,0,0,0,0,0,0,0,0,0,0,0,1,0,0,0,0,0,0
566,i would say to hurt the us,0,0,0,0,0,0,1,0,0,0,0,0,0,0,0,0,0,0,0,0,0,0,0,0,0,0
568,to kill the um infdell,0,0,0,1,0,0,0,0,0,0,0,0,0,0,0,0,0,0,0,0,0,1,0,0,0,0
569,kill amaericans,0,0,0,1,0,0,0,0,0,0,0,0,0,0,0,0,0,0,0,0,0,0,0,0,0,0
570,they wantend to be notice wantend to seem power// they wantend infiules  no,0,0,0,0,1,0,0,0,0,0,0,0,0,0,0,0,0,0,0,1,0,1,0,0,0,1
571,"thin to kill peopl,e",0,0,0,1,0,0,0,0,0,0,0,0,0,0,0,0,0,0,0,0,0,0,0,0,0,0
572,wanted to harm america.,0,0,0,0,0,0,1,0,0,0,0,0,0,0,0,0,0,0,0,0,0,0,0,0,0,0
573,to get attastiuon,0,0,0,0,0,0,0,0,0,0,0,0,0,0,0,0,0,0,0,1,0,0,0,0,0,0
574,you know I really don't i think they were tring to tell us they we are,0,0,0,0,0,0,0,0,0,0,0,0,0,0,0,0,0,0,0,1,0,0,0,0,0,0
575,to place faer in the hearts of amicania,1,0,0,0,0,0,0,0,0,0,0,0,0,0,0,0,0,0,0,0,0,0,0,0,0,0
576,well i think the was trin to make faer  galde by there relegon,1,0,0,0,0,0,0,0,0,0,0,0,0,0,0,0,0,0,0,0,0,1,0,0,0,0
577,um coaoas,0,0,1,0,0,0,0,0,0,0,0,0,0,0,0,0,0,0,0,0,0,0,0,0,0,0
578,to show us the we could be invained,0,0,0,0,1,0,0,0,0,0,0,0,0,0,0,0,0,0,0,0,0,0,0,0,0,0
579,more are less to feel week are vulerable,0,0,0,0,1,0,0,0,0,0,0,0,0,0,0,0,0,0,0,0,0,0,0,0,0,0
580,i dont know what they were trying to prove but what they did was wrong,0,0,0,0,0,0,0,0,0,0,0,0,0,0,0,0,0,0,0,0,0,0,1,0,1,0
581,kill the infadelto get rid of the americans,0,0,0,1,0,0,1,0,0,0,0,0,0,0,0,0,0,0,0,0,0,1,0,0,0,0
582,destroy the government tdestroy the us//,0,0,0,0,0,0,1,0,0,0,1,0,0,0,0,0,0,0,0,0,0,0,0,0,0,0
583,i think they were tryingt to bring america down// they might have been trying to take over i dont know,0,0,0,0,0,0,1,0,0,0,0,0,0,0,0,0,0,0,0,0,0,0,0,0,1,0
584,I dont know//,0,0,0,0,0,0,0,0,0,0,0,0,0,0,0,0,0,0,0,0,0,0,0,0,1,0
585,i believe they wree trying to attract the attention of the us and put fear in us i hopes that whatever problems that they were having with the us would be brought out in the open and put emphasis on those problems,1,0,0,0,0,0,0,0,0,0,0,0,0,0,0,0,0,0,1,1,0,0,0,1,0,0
586,they were trying to accomplish the mission to get us back I remember we went over there and did someithing to them first Busch did somthing,0,0,0,0,0,0,0,0,0,0,0,1,1,0,0,0,0,0,0,0,0,0,0,0,0,0
587,send a message to the US to quit meddlaing in their affairs,0,0,0,0,0,0,0,0,0,0,0,1,0,0,0,0,0,0,0,0,0,0,0,0,0,0
588,to kill as many of us as they could they wanted to be recognized and to say that they were a force to be reconed with and what better way to do that and show the rest of the wporld then to take on the us I think the government knew all about it and did nothing to stopit,0,0,0,1,1,0,0,0,0,0,0,0,0,0,0,0,0,0,0,1,0,0,0,1,0,0
589,obviously to disrupt our way of living our security and all that good stuff,0,0,0,0,0,0,0,0,1,0,0,0,0,0,0,0,0,0,0,0,0,0,0,0,0,0
590,harm america// fear//na,1,0,0,0,0,0,1,0,0,0,0,0,0,0,0,0,0,0,0,0,0,0,0,0,0,1
591,just kill people kill americanss,0,0,0,1,0,0,0,0,0,0,0,0,0,0,0,0,0,0,0,0,0,0,0,0,0,0
592,to make the US back off,0,0,0,0,0,0,0,0,0,0,0,1,0,0,0,0,0,0,0,0,0,0,0,0,0,0
593,destroy our way of freedom,0,0,0,0,0,0,0,0,1,0,0,0,0,0,0,0,0,0,0,0,0,0,0,0,0,0
595,they are all idiots that they could get the americans it doesnt matter to me  to make the white people to wake up im sorry about it i dont care they otta be hung,0,0,0,0,1,0,0,0,0,0,0,0,0,0,0,0,0,0,0,0,0,0,1,0,0,0
596,"I think they were trying to tell us to mind our own buisness, stay out of other countries affairs",0,0,0,0,0,0,0,0,0,0,0,1,0,0,0,0,0,0,0,0,0,0,0,0,0,0
597,scare us// don't se any other reason//na,1,0,0,0,0,0,0,0,0,0,0,0,0,0,0,0,0,0,0,0,0,0,0,0,1,1
598,kill a bunch of people// na,0,0,0,1,0,0,0,0,0,0,0,0,0,0,0,0,0,0,0,0,0,0,0,0,0,1
599,bring fear to US// ealous of what we have//na,1,0,0,0,0,0,0,0,0,0,0,0,0,0,0,0,0,1,0,0,0,0,0,0,0,1
600,create chaos in us an money markets//na,0,0,1,0,0,0,0,0,0,1,0,0,0,0,0,0,0,0,0,0,0,0,0,0,0,1
602,"fear, // na",1,0,0,0,0,0,0,0,0,0,0,0,0,0,0,0,0,0,0,0,0,0,0,0,0,1
603,the most devastating day of my life... they were thrying to prove that they couldnt sb stopped that they could infiltrate us and that they could hurt us and they did,0,1,0,0,1,0,0,0,0,0,0,0,0,0,0,0,0,0,0,0,0,0,0,0,0,0
604,were trying to get noticed// tried to be treatening//na,1,0,0,0,0,0,0,0,0,0,0,0,0,0,0,0,0,0,0,1,0,0,0,0,0,1
605,they ere trying to shut the un down they went after our hub,0,0,0,0,0,0,1,0,0,0,0,0,0,0,0,0,0,0,0,0,0,0,0,0,0,0
606,"I think the  twin towers had something to do with fuisness, so they tried to mess with that I think they wree tryingt to make astatement about out important buildings and I think they would ve tried to take out the white house next trying to make a statement that they could hit our imprtant building and get us in wher thier is money.",0,0,0,0,1,0,0,0,0,1,1,0,0,1,0,0,0,0,0,1,0,0,0,1,0,0
607,can do what ever they want//na,0,0,0,0,1,0,0,0,0,0,0,0,0,0,0,0,0,0,0,0,0,0,0,0,0,1
608,trying to killas many americans as they could to send a message,0,0,0,1,0,0,0,0,0,0,0,0,0,0,0,0,0,0,0,1,0,0,0,0,0,0
609,just to terrorize// make us afraid// threaten our sercurity// na,0,0,0,0,1,0,0,0,0,0,0,0,0,0,0,0,0,0,0,0,0,0,0,0,0,1
611,call attention vengance,0,0,0,0,0,0,0,0,0,0,0,0,1,0,0,0,0,0,0,1,0,0,0,0,0,0
613,to destroy the ubited states system/capatilist system and amerivan soceirty in general and country,0,0,0,0,0,0,1,0,1,0,0,0,0,0,0,0,0,0,0,0,0,0,0,0,0,0
614,"DESTABILIZE US, ECONOMICALLY, MORALLY, IN THE SECURITY LEVEL//ON A TRUST LEVEL IN OUR OWN SECURITY//AND THEY ACOMPLISHED A LOT// IT SERVED TO UNITE US ALSO, TO GIVE IMPORTANCE TO RECUPERATE THE PATRIOTIC SENSE AND TO CREATE NEW PROGRAMS OF NATIONAL SECURITY LIKE HOMELAND SECURITY, LIKE THINGS THAT HAPPENED THAT HAVE NOT BEEN SO EFFECTIVE BEFORE AND IT HAS BEEN AN EFFORT FROM THE FBI AND ALL THE SECURITY GOVERNMENTAL ELEMENTS//STOP",0,0,1,0,1,0,0,0,1,1,0,0,0,0,0,0,0,0,0,0,0,0,0,1,0,1
615,I DON'T KNOW//THEY HAD A DEATH WISH//THEY ARE CRAZY//STOP,0,0,0,0,0,0,0,0,0,0,0,0,0,0,0,0,1,0,0,0,0,0,1,0,1,1
616,to destroy,0,0,0,0,0,0,1,0,0,0,0,0,0,0,0,0,0,0,0,0,0,0,0,0,0,0
617,<RF>,0,0,0,0,0,0,0,0,0,0,0,0,0,0,0,0,0,0,0,0,0,0,0,0,0,1
618,to install fear for the usa/,1,0,0,0,0,0,0,0,0,0,0,0,0,0,0,0,0,0,0,0,0,0,0,0,0,0
622,create a panic i htis counryt to paralyze it,1,0,0,0,0,0,1,0,0,0,0,0,0,0,0,0,0,0,0,0,0,0,0,0,0,0
623,the destruction of the usa,0,0,0,0,0,0,1,0,0,0,0,0,0,0,0,0,0,0,0,0,0,0,0,0,0,0
624,SCARE AND WEAKEN THE GOVERNMENT//STOP,1,0,0,0,0,0,0,0,0,0,1,0,0,0,0,0,0,0,0,0,0,0,0,0,0,1
625,WAR//RELIGION//STOP,0,0,0,0,0,1,0,0,0,0,0,0,0,0,0,0,0,0,0,0,0,1,0,0,0,1
626,SCARE THE POPULATION//RELIGIOUS HATRED OR SOMETHING LIKE THAT// THEY WANT TO CONVERT US TO MUSLIMS FORCEFULLY//CREATE PANIC//DESTROY THE ECONOMIC EMPIRE//STOP,1,0,0,0,0,0,0,0,0,1,0,0,0,0,0,0,0,0,1,0,0,1,0,0,0,1
627,BASICALLY TO BRING US DOWN//SELF GLORIFICATION FOR THEM//STOP,0,0,0,0,0,0,1,0,0,0,0,0,0,0,0,0,0,0,0,1,0,0,0,0,0,1
