caseID,verbatim,1,2,3,4,5,6,7,8,9,10,11,12,13,14,15,16,17,18,19,20,21,22,23,24,25,26,27,28,29,94,95,96,97
1,"social issue standings such as homesexual marriage, abortion rights,",0,0,0,0,0,0,0,0,0,0,0,0,0,0,0,0,0,0,0,1,0,0,0,1,1,0,0,0,0,0,0,0,0
3,"they are concerned with the economic situation,and the poverty stricken and those less fortunate,",0,0,0,0,0,0,0,0,0,0,0,0,0,0,0,0,0,1,0,0,0,0,0,0,1,0,0,0,0,0,0,0,0
10,"they are more intouch with the average american family, they are more concerned about the have-nots more than the rep. party is",0,1,0,0,0,0,0,0,0,0,0,0,0,0,0,0,0,0,0,0,0,0,0,0,1,0,0,0,0,0,0,0,0
16,the way they understand and vote that understanding on health and human services... like Chris Dodd - the way he works for and speaks out for children.,0,0,1,0,0,0,0,1,0,0,0,0,0,0,0,0,0,0,0,0,0,0,0,1,1,0,0,0,0,0,0,1,0
17,"i was raised to be a Democrat..., I really don't know... I've heard it's like... the Democratic people, they don't make much and the Republicans... they make more but they don't want people to make more...",1,1,0,0,0,0,0,0,0,0,0,0,0,0,0,0,1,1,0,0,0,0,0,0,0,0,1,0,1,1,0,1,0
19,"The exact opposite of the Republicans.  The Democrats have always been the party of the people.  They understand that when the individual fails, or the local government fails, someone has to step up and help.  I think the Democratic party is traditionally the party that works better internationally... builds better alliances.",1,1,0,0,0,0,0,1,0,0,0,0,1,0,0,0,0,0,0,0,0,1,1,1,1,0,1,1,0,0,0,1,0
22,"I like some of their running mates,I grew up Dem.",0,0,0,0,0,0,0,0,0,0,0,0,0,0,0,0,0,0,0,0,0,0,0,0,0,0,1,0,1,0,0,1,0
23,they like to work more with the middle class,0,0,0,0,0,0,0,0,0,0,0,0,0,0,0,0,0,0,0,0,0,0,0,1,1,0,0,0,0,0,0,0,0
24,they're more liberal and I'm very liberal thinking,0,0,0,1,0,0,0,0,0,0,0,0,0,0,0,0,0,0,0,0,0,0,0,0,0,0,0,0,0,0,0,1,0
25,they deal with problems in our country andthey have the potential to deal more with foreings problems but they take care of the people in america first,0,0,0,0,0,0,0,0,0,0,0,0,1,0,0,0,0,0,0,0,0,0,1,1,1,0,0,0,0,0,0,0,0
26,there for universal health insurance,0,0,0,0,0,0,0,0,0,0,0,0,0,0,0,0,0,0,0,0,0,0,0,1,0,0,0,0,0,0,0,0,0
28,favortism towaeds healthcare issues n the people of the country as a whole,0,0,0,0,0,0,0,0,0,0,0,0,0,0,0,0,0,0,0,0,0,0,0,1,1,0,0,0,0,0,0,0,0
30,previous experience tells me that things are better with the democrats in office.,1,0,0,0,0,0,0,1,0,0,0,0,1,0,0,0,0,0,0,0,0,0,0,0,0,0,0,0,0,0,0,1,0
34,"they are for the labor union, for the lower class people",0,0,0,0,0,0,0,0,0,0,0,0,0,0,0,0,0,0,0,0,0,0,0,0,1,0,0,0,0,0,0,0,0
35,they pay lip service to the environment,0,0,0,0,0,0,0,0,0,0,0,0,0,0,0,0,0,0,0,0,0,0,0,1,0,0,0,0,0,0,0,0,0
37,more conservative,0,0,0,1,0,0,0,0,0,0,0,0,0,0,0,0,0,0,0,0,0,0,0,0,0,0,0,0,0,0,0,0,0
38,they think of the public,0,0,0,0,0,0,0,0,0,0,0,0,0,0,0,0,0,0,0,0,0,0,0,0,1,0,0,0,0,0,0,0,0
39,they are geared more towards younger people,0,0,0,0,0,0,0,0,0,0,0,0,0,0,0,0,0,0,0,0,0,0,0,0,1,0,0,0,0,0,0,0,0
40,they are not mean spirited and our open minded,1,0,0,0,0,0,0,0,0,0,0,0,0,0,0,0,0,0,0,0,0,0,0,0,0,0,1,0,0,0,0,0,0
41,they seem to be more focused on poverty,0,0,0,0,0,0,0,0,0,0,0,0,0,0,0,0,0,0,0,0,0,0,0,0,1,0,0,0,0,0,0,0,0
43,They give more to the average people than the rich.,0,0,0,0,0,0,0,0,0,0,0,0,0,0,0,0,0,0,0,0,0,0,0,1,1,0,0,0,0,0,0,0,0
44,they embrace the majority which is a broader spectrum of the population.  social views are more in line with mine.,0,0,0,0,0,0,0,0,0,0,0,0,0,0,0,0,0,0,0,0,0,0,0,1,1,0,0,0,0,0,0,1,0
47,they finally got a candidate who could win,0,0,0,0,1,0,1,0,0,0,0,0,0,0,0,0,0,0,0,0,0,0,0,0,0,0,0,0,0,0,0,0,0
48,how they handle the environment,0,0,0,0,0,0,0,0,0,0,0,0,0,0,0,0,0,0,0,0,0,0,0,1,0,0,0,0,0,0,0,0,0
50,they are for more government,0,0,0,0,0,0,0,0,0,0,0,0,0,0,0,0,0,0,0,0,0,0,0,1,0,0,0,0,0,0,0,0,0
51,more open minded,0,0,0,0,0,0,0,0,0,0,0,0,0,0,0,0,0,0,0,0,0,0,0,0,0,0,1,0,0,0,0,0,0
52,they help the economy more than the republicans,0,1,0,0,0,0,0,0,0,0,0,0,0,0,0,0,0,1,0,0,0,0,0,0,0,0,0,0,0,0,0,0,0
54,"they like a bigger governmet, they want privided aid to people that need it",0,0,0,0,0,0,0,0,0,0,0,0,0,0,0,0,0,0,0,0,0,0,0,1,1,0,0,0,0,0,0,0,0
55,more social and envitomentaly consius,0,0,0,0,0,0,0,0,0,0,0,0,0,0,0,0,0,0,0,0,0,0,0,1,0,0,0,0,0,0,0,0,0
56,they are going to make change and make it better,0,0,0,0,0,0,0,0,0,0,0,0,1,0,0,0,0,0,0,0,0,0,0,1,0,0,0,0,0,0,0,0,0
57,trial and error,0,0,0,0,0,0,0,0,0,0,0,0,0,0,0,0,0,0,0,0,0,0,0,0,0,0,0,1,0,0,0,0,0
58,care more about the people,0,0,0,0,0,0,0,0,0,0,0,0,0,0,0,0,0,0,0,0,0,0,0,0,1,0,0,0,0,0,0,0,0
59,economy and war,0,0,0,0,0,0,0,0,0,0,0,0,0,0,0,0,0,1,0,0,1,0,0,0,0,0,0,0,0,0,0,0,0
61,more liberal then they been,0,0,0,1,0,0,0,0,0,0,0,0,0,0,0,0,0,0,0,0,0,0,0,0,0,0,0,0,0,0,0,0,0
65,"i think they are environmentally conscious, i think their tendency is to provide support for the common person, i think they are more socially liberal, and they favor regulation of corporations,",0,0,0,1,0,0,0,0,0,0,0,0,0,0,0,0,0,0,0,0,0,0,0,1,1,0,0,0,0,0,0,1,0
66,their ideas about health care and personal freedom and responsibility to the community their ideas about how to protect the environement their general health care policies,0,0,0,1,0,0,0,0,0,0,0,0,0,0,0,0,0,0,0,1,0,0,0,1,1,0,0,0,0,0,0,0,0
67,i don't approve of what they are doing i don't know if i can answer that,0,0,0,0,0,0,0,0,0,0,0,0,0,0,0,0,0,0,0,0,0,0,0,1,0,0,0,0,0,1,0,1,0
68,"ali;gned with my politics, more liberal agenda, right to choose, proper beneafits for proper taxes, more positive gay rightds stance",1,0,0,1,0,0,0,0,0,0,0,0,0,0,0,0,0,1,0,1,0,0,0,1,1,0,0,0,0,0,0,0,0
69,"i believe they genuinely try to be inclusive and to look out for people with fewer resources,",0,0,0,0,0,0,0,0,0,0,0,0,0,0,0,0,0,0,1,0,0,0,0,0,1,0,1,0,0,0,0,1,0
70,"the fact tht i believe they will take care of not only the top part of the country but will take care of the people who need to be rewarded for their work, focus on foreign policie3s and diplomacy restore image and credibility of us in the world, focus on health care for everybody, and regulation as far as economy is concerned to prevent situation like we are in now",0,0,0,0,0,0,0,0,0,0,0,0,0,0,0,0,0,1,0,0,0,0,1,1,1,0,1,0,0,0,0,1,0
71,"and the dems are better on environ,ment issues",1,0,0,0,0,0,0,0,0,0,0,0,0,0,0,0,0,0,0,0,0,0,0,1,0,0,0,0,0,0,0,0,0
72,"they tend to think about the people more, they got more issues resolved,",0,0,0,0,0,0,0,0,0,0,0,0,1,0,0,0,0,0,0,0,0,0,0,1,1,0,0,0,0,0,0,0,0
73,everything,1,0,0,0,0,0,0,0,0,0,0,0,0,0,0,0,0,0,0,0,0,0,0,0,0,0,0,0,0,0,0,0,0
74,"are more for the people,more for the working class people,and they are for the poor people that need the healthcare services, and for our schools, education,",0,0,0,0,0,0,0,0,0,0,0,0,0,0,1,0,0,0,1,0,0,0,0,1,1,0,0,0,0,0,0,0,0
75,"seems to be more choice for the people,",0,0,0,0,0,0,0,0,0,0,0,0,0,0,0,0,0,0,0,1,0,0,0,0,1,0,0,0,0,0,0,0,0
76,"incliusiveness, diversity, concern for social policies, perpspective on tasxes and who outght to be paying bigger share, openness to debate, more of a tendency to be empowering and positive, lets say constructive and positive rather than negative and judgmental, particularly i like the policy relative to gay rights, more favorabel to democrats their, health care policies, programs and energy policies, foreign relations attitude,",1,0,0,1,0,0,0,0,0,0,0,0,0,0,0,0,1,1,0,1,0,0,1,1,1,0,1,0,0,0,0,1,0
77,"i like that they are trying to be responsibve to the needs of the people, i like their ideas on health care, foreign policy, mostly their energy policy is good, and i think they are more tolerant of different views,",0,0,0,0,0,0,0,0,0,0,0,0,0,0,0,0,0,0,0,0,0,0,1,1,1,0,1,0,0,0,0,1,0
78,no,0,0,0,0,0,0,0,0,0,0,0,0,0,0,0,0,0,0,0,0,0,0,0,0,0,0,0,0,0,1,0,0,0
79,"they are more liberal and they are not perfect but i feel like they gauge correctly in a tempermatic system and make the best decisions they can, you can't make everybody and you have to make the best decisions for the whole classroom of people and the republican party doesn't look at it like that",1,1,0,1,0,0,0,0,1,0,0,0,1,0,0,0,0,0,0,0,0,0,0,1,1,0,0,1,0,0,0,1,0
80,likes that they want to help the poor,1,0,0,0,0,0,0,0,0,0,0,0,0,0,0,0,0,0,1,0,0,0,0,0,1,0,0,0,0,0,0,0,0
81,THEY'RE MORE LIBERAL,0,0,0,1,0,0,0,0,0,0,0,0,0,0,0,0,0,0,0,0,0,0,0,0,0,0,0,0,0,0,0,0,0
83,like what he says about taxes,0,0,0,0,0,0,0,0,0,0,0,0,0,0,0,0,0,1,0,0,0,0,0,0,0,0,0,0,0,0,0,1,0
84,they think about everybody around the world,0,0,0,0,0,0,0,0,0,0,0,0,0,0,0,0,0,0,0,0,0,0,0,0,1,0,0,0,0,0,0,0,0
85,"they're idealism, they think they can take care of everybody",0,0,0,1,0,0,0,0,0,0,0,0,0,0,0,0,0,0,0,0,0,0,0,1,1,0,0,0,0,0,0,0,0
87,they seem to want to help more of the low income,0,0,0,0,0,0,0,0,0,0,0,0,0,0,0,0,0,0,1,0,0,0,0,0,1,0,0,0,0,0,0,0,0
88,their track record when it comes to economy and jobs,0,0,0,0,0,0,0,1,0,0,0,0,0,0,0,0,0,1,0,0,0,0,0,0,0,0,0,0,0,0,0,0,0
89,when we have had dem leaders they have led us in a good way,1,0,0,0,0,0,0,0,0,0,0,1,0,0,0,0,0,0,0,0,0,0,0,0,0,0,0,0,0,0,0,0,0
91,health care issues,0,0,0,0,0,0,0,0,0,0,0,0,0,0,0,0,0,0,0,0,0,0,0,1,0,0,0,0,0,0,0,0,0
92,the republicans make more money then lower class being helped by democrats,1,1,0,0,0,0,0,0,0,0,0,0,0,0,0,0,1,0,1,0,0,0,0,0,1,0,0,0,0,0,0,0,0
95,think they can clean up the mess the republican made,0,1,0,0,0,0,0,0,1,0,0,0,0,0,0,0,0,0,0,0,0,0,0,0,0,0,0,0,0,0,0,1,0
97,THEIR VIEWS ON HEALTH CARE AND TAXES,0,0,0,0,0,0,0,0,0,0,0,0,0,0,0,0,0,1,0,0,0,0,0,1,0,0,0,0,0,0,0,0,0
98,they care more for the middle to lower class,0,0,0,0,0,0,0,0,0,0,0,0,0,0,0,0,0,0,0,0,0,0,0,0,1,0,0,0,0,0,0,0,0
100,care more for the unskilled and uneducated,0,0,0,0,0,0,0,0,0,0,0,0,0,0,0,0,0,0,0,0,0,0,0,0,1,0,0,0,0,0,0,0,0
101,"help a broad spectrum of people, more willing to help",0,0,0,0,0,0,0,0,0,0,0,0,0,0,0,0,0,0,0,0,0,0,0,1,1,0,0,0,0,0,0,0,0
104,THEY DO WHAT IT TAKES TO RUN THE COUNTRY,0,0,0,0,0,0,0,0,0,0,0,0,1,0,0,0,0,0,0,0,0,0,0,0,0,0,0,0,0,0,0,0,0
105,what they're trying to do is what I want to see happen 98% of the time,0,0,0,0,0,0,0,0,0,0,0,0,0,0,0,0,0,0,0,0,0,0,0,1,0,0,0,0,0,0,0,1,0
106,respect towards civil rights,0,0,0,0,0,0,0,0,0,0,0,0,0,0,0,0,0,0,0,1,0,0,0,0,0,0,0,0,0,0,0,0,0
108,they favor the working people and middle class people.,0,0,0,0,0,0,0,0,0,0,0,0,0,0,0,0,0,0,0,0,0,0,0,0,1,0,0,0,0,0,0,0,0
110,how they handle health and welfare,0,0,0,0,0,0,0,0,0,0,0,0,0,0,0,0,0,0,1,0,0,0,0,1,0,0,0,0,0,0,0,0,0
111,they think more about the people and are more humain.,0,0,0,0,0,0,0,0,0,0,0,0,0,0,0,0,0,0,0,0,0,0,0,0,1,0,1,0,0,0,0,0,0
113,they do alittle bit better for the minority people,0,0,0,0,0,0,0,0,0,0,0,0,0,0,0,0,0,0,0,0,0,0,0,1,1,0,0,0,0,0,0,0,0
115,cause democratics are for Obama and dont know to much more about them,1,0,1,0,0,0,0,0,0,0,0,0,0,0,0,0,0,0,0,0,0,0,0,0,0,0,0,0,0,1,0,0,0
116,to me the democratic party represents the party of choice or options-meaning they try to give all people rights.,1,0,0,0,0,0,0,0,0,0,0,0,0,0,0,0,0,0,0,1,0,0,0,0,1,0,1,0,0,0,0,1,0
118,I THINK THEY'RE INTERESTED IN OTHER PEOPLE'S LIVES AND THE ECONOMY. I THIN THEY'RE PRETTY FAIR IN A LOT OF THEIR ISSUES THAT HAPPENING AROUND THE WORLD,0,0,0,0,0,0,0,0,0,0,0,0,0,0,0,0,0,1,0,0,0,0,1,0,1,0,1,0,0,0,0,1,0
121,"i think they're stand more for the people, since i'm from a poor background",0,0,0,0,0,0,0,0,0,0,0,0,0,0,0,0,0,0,0,0,0,0,0,0,1,0,0,0,0,0,0,1,0
122,i think they are trying to help the middle class and the poor.,0,0,0,0,0,0,0,0,0,0,0,0,0,0,0,0,0,0,1,0,0,0,0,1,1,0,0,0,0,0,0,1,0
123,I have similar views with them,0,0,0,0,0,0,0,0,0,0,0,0,0,0,0,0,0,0,0,0,0,0,0,1,0,0,0,0,0,0,0,1,0
131,more lib towards the thepoeple,0,0,0,1,0,0,0,0,0,0,0,0,0,0,0,0,0,0,0,0,0,0,0,0,1,0,0,0,0,0,0,0,0
132,socal walfare  & right to choice  & i all so like,1,0,0,0,0,0,0,0,0,0,0,0,0,0,0,0,0,0,1,1,0,0,0,0,0,0,0,0,0,0,0,0,0
135,pullin out of the war,0,0,0,0,0,0,0,0,0,0,0,0,0,0,0,0,0,0,0,0,1,0,0,0,0,0,0,0,0,0,0,0,0
136,party for the younger people,1,0,0,0,0,0,0,0,0,0,0,0,0,0,0,0,0,0,0,0,0,0,0,0,1,0,0,0,0,0,0,0,0
138,to me they seem to be about the people.,0,0,0,0,0,0,0,0,0,0,0,0,0,0,0,0,0,0,0,0,0,0,0,0,1,0,0,0,0,0,0,1,0
142,they are better than what has happened the last eight yrs.,0,0,0,0,0,0,0,0,0,0,0,0,1,0,0,0,0,0,0,0,0,0,0,0,0,0,0,0,0,0,0,0,0
144,freedow,0,0,0,0,0,0,0,0,0,0,0,0,0,0,0,0,0,0,0,1,0,0,0,0,0,0,0,0,0,0,0,0,0
145,like that they are doing things in the interest of humanity,0,0,0,0,0,0,0,0,0,0,0,0,0,0,0,0,0,0,0,0,0,0,0,1,0,0,0,0,0,0,0,1,0
146,it is a more liberal party,1,0,0,1,0,0,0,0,0,0,0,0,0,0,0,0,0,0,0,0,0,0,0,0,0,0,0,0,0,0,0,0,0
147,"people are envolved, but i guestion their involvment.",0,0,0,0,0,0,0,0,0,0,0,0,0,0,0,0,0,0,0,0,0,0,0,0,0,0,1,0,0,0,0,1,0
150,"the good for the common peoples welfare-enviroment, health care",0,0,0,0,0,0,0,0,0,0,0,0,0,0,0,0,0,0,0,0,0,0,0,1,1,0,0,0,0,0,0,0,0
151,they are pro abortion.,0,0,0,0,0,0,0,0,0,0,0,0,0,0,0,0,0,0,0,1,0,0,0,0,0,0,0,0,0,0,0,0,0
152,they represent an opposing view on polictics in our republic.,0,0,0,0,0,0,0,0,0,0,0,0,0,0,0,0,0,0,0,0,0,0,0,1,0,0,0,0,0,0,0,0,0
155,seems to have more heart and make things better.,0,0,0,0,0,0,0,0,0,0,0,0,1,0,0,0,0,0,0,0,0,0,0,0,0,0,1,0,0,0,0,0,0
156,better schooling that addresses real life and is competive with the rest of the world.,0,0,0,0,0,0,0,0,0,0,0,0,0,0,0,0,0,0,0,0,0,0,0,1,0,0,0,0,0,0,0,0,0
157,that they are not republican,0,1,0,0,0,0,0,0,0,0,0,0,0,0,0,0,0,0,0,0,0,0,0,0,0,0,0,0,0,0,0,0,0
158,they balance the budget and can still provide great services for the people who need it.,0,0,0,0,0,0,0,0,0,0,0,0,0,0,0,0,0,1,0,0,0,0,0,1,1,0,0,0,0,0,0,0,0
160,most of it is pro-choice and it's favorable towards women and lower classes,0,0,0,0,0,0,0,0,0,0,0,0,0,0,0,0,0,0,0,1,0,0,0,0,1,0,0,0,0,0,0,0,0
162,environmental issues,0,0,0,0,0,0,0,0,0,0,0,0,0,0,0,0,0,0,0,0,0,0,0,1,0,0,0,0,0,0,0,0,0
164,<DK>,0,0,0,0,0,0,0,0,0,0,0,0,0,0,0,0,0,0,0,0,0,0,0,0,0,0,0,0,0,1,0,0,0
167,they want to make changes and we need change,0,0,0,0,0,0,0,0,0,0,0,0,0,0,0,0,0,0,0,0,0,0,0,1,0,0,0,0,0,0,0,0,0
168,they do alot of things better for the poor and betty convinient for the low income,0,0,0,0,0,0,0,0,0,0,0,0,0,0,0,0,0,0,1,0,0,0,0,0,1,0,0,0,0,0,0,0,0
170,better newws for the people,0,0,0,0,0,0,0,0,0,0,0,0,1,0,0,0,0,0,0,0,0,0,0,0,1,0,0,0,0,0,0,0,0
171,"i like the way they talk about fixing the economy, the way they're going to help on the taxes and poor people, medicare",0,0,0,0,0,0,0,0,0,0,0,0,0,0,0,0,0,1,1,0,0,0,0,1,1,0,0,0,0,0,0,1,0
172,"the democracy,the variety of changes in the system or diferent ideas and willing to change for a better system",1,0,0,1,0,0,0,0,0,0,0,0,1,0,0,0,0,0,0,0,0,0,0,1,0,0,0,0,0,0,0,0,0
173,i think that all the nation is going to be better,0,0,0,0,0,0,0,0,0,0,0,0,1,0,0,0,0,0,0,0,0,0,0,0,0,0,0,0,0,0,0,1,0
175,for the middle class,0,0,0,0,0,0,0,0,0,0,0,0,0,0,0,0,0,0,0,0,0,0,0,0,1,0,0,0,0,0,0,0,0
176,"they give more vision for the average person in America, have more specific plans for education, and environments,health care",0,0,0,0,0,0,0,0,0,0,0,0,0,0,0,0,0,0,0,0,0,0,0,1,1,0,0,0,0,0,0,0,0
177,general position on the economy,0,0,0,0,0,0,0,0,0,0,0,0,0,0,0,0,0,1,0,0,0,0,0,0,0,0,0,0,0,0,0,0,0
178,"improves health care,say they want toget out of the war,to improve social programs",0,0,0,0,0,0,0,0,0,0,0,0,0,0,0,0,0,0,0,0,1,0,0,1,0,0,0,0,0,0,0,0,0
179,more people oriented,0,0,0,0,0,0,0,0,0,0,0,0,0,0,0,0,0,0,0,0,0,0,0,0,1,0,0,0,0,0,0,0,0
181,they were for the working class,0,0,0,0,0,0,0,0,0,0,0,0,0,0,0,0,0,0,0,0,0,0,0,0,1,0,0,0,0,0,0,0,0
183,"they are more liberal than rep, it is important to have a balance,",0,1,0,1,0,0,0,0,0,0,0,0,0,0,0,0,0,1,0,0,0,0,0,0,0,0,0,0,0,0,0,0,0
188,"fundamental belief in equal opportunity and supporting it , supporting the minority. believe in investing in the infrastructure of the u.s. and that promotes investing in the people who live in the u.s.",0,0,0,0,0,0,0,0,0,0,0,0,0,0,0,0,0,1,0,0,0,0,0,1,1,0,0,0,0,0,0,0,0
189,they put money in to social programs and the education,0,0,0,0,0,0,0,0,0,0,0,0,0,0,0,0,0,0,0,0,0,0,0,1,0,0,0,0,0,0,0,0,0
193,The views are not conservative.,0,0,0,1,0,0,0,0,0,0,0,0,0,0,0,0,0,0,0,0,0,0,0,0,0,0,0,0,0,0,0,0,0
196,new ideas,0,0,0,1,0,0,0,0,0,0,0,0,0,0,0,0,0,0,0,0,0,0,0,0,0,0,0,0,0,0,0,0,0
197,"he likes that he provide good education, stable economic",1,0,0,0,0,0,0,0,0,0,0,0,0,0,0,0,0,1,0,0,0,0,0,1,0,0,0,0,0,0,0,0,0
198,"they seem to favor and support minorities, they care for the environment, care for healthcare,",0,0,0,0,0,0,0,0,0,0,0,0,0,0,0,0,0,0,0,0,0,0,0,1,1,0,0,0,0,0,0,0,0
200,I like they seem to be on same page even with the republicans.  I don't vote for any partt,1,1,0,0,0,0,0,0,0,0,0,0,0,0,0,0,0,0,0,0,0,0,0,0,0,0,1,0,0,0,0,1,0
205,"domestic agenda, environent,",0,0,0,0,0,0,0,0,0,0,0,0,0,0,0,0,0,0,0,0,0,0,0,1,0,0,0,0,0,0,0,0,0
206,"MAS A AYUDAR A LOS IMIGRANTES, CLASE MEDIA, MAS POR NOSOTROS LOS QUE TENEMOS MENOS,",0,0,0,0,0,0,0,0,0,0,0,0,0,0,0,0,0,0,0,0,0,0,0,1,1,0,0,0,0,0,0,0,0
212,tHEY CARE MORE ABOUT MIIUDLLE AND LOWER CLASS AS RICH.  mORE SINCERE  AND WANT THE LOWER CLASS PEOPLE TO MAKE IT,0,0,0,0,0,0,0,0,0,1,0,0,0,0,0,0,0,0,1,0,0,0,0,0,1,0,0,0,0,0,0,0,0
214,"more jobs for the people, he wants the army out of iraq",0,0,0,0,0,0,0,0,0,0,0,0,0,0,0,0,0,1,0,0,1,0,0,0,0,0,0,0,0,0,0,0,0
216,i am in favor of all the ideals they have,0,0,0,1,0,0,0,0,0,0,0,0,0,0,0,0,0,0,0,0,0,0,0,0,0,0,0,0,0,0,0,1,0
218,I like how they look out for the little people in the coutry. They handle the taxes complately different.,0,0,0,0,0,0,0,0,0,0,0,0,0,0,0,0,0,1,0,0,0,0,0,1,1,0,0,0,0,0,0,1,0
219,"all the things they are trying to improve, the economy, to change the country, bringing our kids back from war, they are being killed for nothing, working more for the blue collar people than the white collar people, giving more opportunities",0,0,1,0,0,0,0,0,0,0,0,0,0,0,0,0,0,1,0,0,1,0,0,1,1,0,0,0,0,0,0,0,0
221,"THEY DO REPRESENT A VAST POLITICAL PARTY, THAT COVERS ALL RACES. AND MALE AND FEMALE FROM ALL WALKS OF LIFE. GAY AND LESBIAN",1,0,0,0,0,0,0,0,0,0,0,0,0,0,0,0,0,0,0,0,0,0,0,0,1,0,1,0,0,0,0,0,0
222,"they are for union,",0,0,0,0,0,0,0,0,0,0,0,0,0,0,0,0,0,0,0,0,0,0,0,0,1,0,0,0,0,0,0,0,0
225,"the care that they have for the middle class, keep good jobs in america, healthcare for everyone",0,0,0,0,0,0,0,0,0,0,0,0,0,0,0,0,0,1,0,0,0,0,0,1,1,0,0,0,0,0,0,0,0
227,Years have been  running the country have been good,0,0,0,0,0,0,0,1,0,0,0,0,1,0,0,0,0,0,0,0,0,0,0,0,0,0,0,0,0,0,0,0,0
228,the more for the people,0,0,0,0,0,0,0,0,0,0,0,0,0,0,0,0,0,0,0,0,0,0,0,0,1,0,0,0,0,0,0,0,0
229,"has probabilities for middle class,",0,0,0,0,0,0,0,0,0,0,0,0,0,0,0,0,0,0,0,0,0,0,0,1,1,0,0,0,0,0,0,0,0
230,they are more for the people then the republican,0,1,0,0,0,0,0,0,0,0,0,0,0,0,0,0,0,0,0,0,0,0,0,0,1,0,0,0,0,0,0,0,0
232,SEAMS TO BE MORE FAVOBLE POR CLASS PEOPLE MIDDLE INCOME,0,0,0,0,0,0,0,0,0,0,0,0,0,0,0,0,0,0,0,0,0,0,0,0,1,0,0,0,0,0,0,0,0
233,like way they are dealing with the health care,0,0,0,0,0,0,0,0,0,0,0,0,0,0,0,0,0,0,0,0,0,0,0,1,0,0,0,0,0,0,0,1,0
234,it seems traditionaly that dems are for the underdog. FDR did things to help the poor and KFK tried to help the poor. I think his bro would have helped the underdog too and for this reason Im for the democrats.,1,0,1,0,0,0,0,0,0,0,0,0,0,0,0,0,0,0,1,0,0,0,0,1,1,0,0,0,0,0,0,1,0
236,I think that they at least talk more what they want.  Help the middle class and working class more.,0,0,0,0,0,0,0,0,0,0,0,0,0,0,0,0,0,0,0,0,0,0,0,1,1,0,1,0,0,0,0,1,0
238,"they do tend to try to help the community a bit more, everyone has to agree, it 's ablend , wish there were more options than just two, i would like ralph nader, i'd like more time to think about the issues, can't wait til i graduate to have time for other things",0,0,1,0,0,0,0,0,0,0,0,0,0,0,0,0,0,0,0,0,0,0,0,1,1,0,0,1,0,0,0,1,0
239,I do believe in pro choice and believe in some of their social issues,0,0,0,0,0,0,0,0,0,0,0,0,0,0,0,0,0,0,0,1,0,0,0,1,0,0,0,0,0,0,0,1,0
240,In this election it is the best for the country,0,0,0,0,0,0,0,0,0,0,0,0,1,0,0,0,0,0,0,0,0,0,0,0,0,0,0,0,0,0,0,0,0
242,There welfare programs are good.,0,0,0,0,0,0,0,0,0,0,0,0,0,0,0,0,0,0,1,0,0,0,0,0,0,0,0,0,0,0,0,0,0
244,"they are for the middle class , i like that , i am on the fence about both parties, i like some of the people like bill clinton and hillary and jack kennedy, they do have some people who have been there too long, like kennedy, biden, and lieberman, not sure if lieberman is even a democrat any more",1,1,1,0,0,0,0,1,0,0,0,0,0,0,0,0,0,0,0,0,0,0,0,0,1,0,0,0,0,0,0,1,0
245,that we have one/  that we still have different views and opinions keep things in check/ good for the welfare of the United States/  population concerns/  healthcare/ jobs/ health benefits.,1,0,0,0,0,0,0,0,0,0,0,0,1,0,0,0,0,1,0,0,0,0,0,1,1,0,1,0,0,0,0,1,0
246,I like their public relations.  I kind of think more favorable towards  lower class. I like the way the seem to include everybody in the country.    Some of their views on the military,0,0,0,0,0,0,0,0,0,0,0,0,0,0,0,0,0,0,0,0,0,0,0,1,1,0,1,0,0,0,0,1,0
248,"High Ideals admirable I feel, compassionate",0,0,0,1,0,0,0,0,0,0,0,0,0,0,0,0,0,0,0,0,0,0,0,0,0,0,1,0,0,0,0,1,0
249,Seem to me for more the regular perosn,0,0,0,0,0,0,0,0,0,0,0,0,0,0,0,0,0,0,0,0,0,0,0,0,1,0,0,0,0,0,0,1,0
251,I was raised Democratic and my parents were democrats and saved them from starvation.  I always agree with what they have done.  A party of the people more than republicans,1,1,1,0,0,0,0,0,0,0,0,0,1,0,0,0,0,0,1,0,0,0,0,0,1,0,0,0,1,0,0,1,0
252,i think they are for the little people.,0,0,0,0,0,0,0,0,0,0,0,0,0,0,0,0,0,0,0,0,0,0,0,0,1,0,0,0,0,0,0,1,0
254,they more concern about the average person then what the think rich person,0,0,0,0,0,0,0,0,0,0,0,0,0,0,0,0,0,0,0,0,0,0,0,0,1,0,0,0,0,0,0,0,0
255,they claim to be for the working people,0,0,0,0,0,0,0,0,0,0,0,0,0,0,0,0,0,0,0,0,0,0,0,0,1,0,0,0,0,0,0,0,0
256,"theyre liberal, they sometimes go too far with abortion and homosexuality aspects",0,0,0,1,0,0,0,0,0,0,0,0,0,0,0,0,0,0,0,1,0,0,0,1,1,0,1,0,0,0,0,0,0
257,"they emphasize the importance of education and try to make policies that improve the resources and quality of education. Such as helping people attend college more affordably, also the push in recent years to put focus on the environment. I guess they have made environmental issues a priority and are trying to make the pursuit of alternative fuels a priority. generally pursue more diplomatic policies and look to our allies to address international threats using our role to help mediate rather than instigate global conflict such as when Bill Clinton helped broker the 1998 Good Friday Agreement in No Ireland and the Balkan states.",0,0,1,0,0,0,0,1,0,0,0,0,0,0,0,0,0,1,0,0,1,1,1,1,1,0,0,0,0,0,0,1,0
258,"health care, iraq war and bringing the trpoops home  but going back into Afghanistan",0,0,0,0,0,0,0,0,0,0,0,0,0,0,0,0,0,0,0,0,1,0,0,1,0,0,0,0,0,0,0,0,0
259,they try to mhelp people,0,0,0,0,0,0,0,0,0,0,0,0,0,0,0,0,0,0,0,0,0,0,0,1,1,0,0,0,0,0,0,0,0
261,THEY SEEM A LITTLE BIT MORE FOR THE WORKING CLASS PEOPLE LIKE ME,0,0,0,0,0,0,0,0,0,0,0,0,0,0,0,0,0,0,0,0,0,0,0,0,1,0,0,0,0,0,0,1,0
263,they always fight for human rights and equal rights it seem that they are more concerned about Hispanics,0,0,0,0,0,0,0,0,0,0,0,0,0,0,0,0,0,0,0,1,0,0,0,0,1,0,0,0,0,0,0,0,0
270,the seem like they are more for the working people and right now that is all,0,0,0,0,0,0,0,0,0,0,0,0,0,0,0,0,0,0,0,0,0,0,0,0,1,0,0,0,0,1,0,0,0
272,"tried to reform health plans,concious of the environment, more effort in getting out of the war",0,0,0,0,0,0,0,0,0,0,0,0,0,0,0,0,0,0,0,0,1,0,0,1,0,0,0,0,0,0,0,0,0
274,"usually like their positions on enviromental, womens rights",0,0,0,0,0,0,0,0,0,0,0,0,0,0,0,0,0,0,0,1,0,0,0,1,1,0,0,0,0,0,0,1,0
275,they seem more labor oriented rather than corporate oriented  they seem to be on the side of the working class the middle class rather than the gazillionaires,0,0,0,0,0,0,0,0,0,0,0,0,0,0,0,0,0,0,0,0,0,0,0,0,1,0,0,0,0,0,0,0,0
276,they have compassion for less fortunate people,0,0,0,0,0,0,0,0,0,0,0,0,0,0,0,0,0,0,0,0,0,0,0,0,1,0,0,0,0,0,0,0,0
277,Foreign policy stances,0,0,0,0,0,0,0,0,0,0,0,0,0,0,0,0,0,0,0,0,0,0,1,0,0,0,0,0,0,0,0,0,0
278,overall cost of living is better with the democrats,1,0,0,0,0,0,0,0,0,0,0,0,1,0,0,0,0,1,0,0,0,0,0,0,0,0,0,0,0,0,0,0,0
279,and of course the democratic party selexted barack obama,1,0,1,0,0,0,0,0,0,0,0,0,0,0,0,0,0,0,0,0,0,0,0,0,0,0,0,0,0,0,0,0,0
280,i feel that they are trying to make a change trying to get a woman or a black man,0,0,0,0,0,0,0,0,0,0,0,0,0,0,0,0,1,0,0,0,0,0,0,1,0,0,0,0,0,0,0,1,0
281,i really like how they keep open communication especially in foreign affairs and how they bring all parties together for discussion and how they look beyond the box,1,0,0,0,0,0,0,0,0,0,0,0,0,0,0,0,0,0,0,0,0,0,1,0,0,0,1,0,0,0,0,1,0
282,no,0,0,0,0,0,0,0,0,0,0,0,0,0,0,0,0,0,0,0,0,0,0,0,0,0,0,0,0,0,1,0,0,0
283,"THEIR CONCERN ABOUT THE ECONOMY, HEALTH CARE, JOB GROWTH, AND THEIR OVERALL MODERATION ON MOST ISSUES",0,0,0,1,0,0,0,0,0,0,0,0,0,0,0,0,0,1,0,0,0,0,0,1,0,0,0,0,0,0,0,0,0
284,"MORE FOR THE GENERAL PUBLIC,NOT AS MANIPULATIVE,makes me feel more comfortable",0,0,0,0,0,0,0,0,0,0,0,0,0,0,0,0,0,0,0,0,0,0,0,0,1,1,1,0,0,0,0,0,0
285,it feels like kinder people to me,0,0,0,0,0,0,0,0,0,0,0,0,0,0,0,0,0,0,0,0,0,0,0,0,0,0,1,0,0,0,0,1,0
286,"like democrats views on handling the war, the economy and health care",1,0,0,0,0,0,0,0,0,0,0,0,0,0,0,0,0,1,0,0,1,0,0,1,0,0,0,0,0,0,0,1,0
287,i feel the democratic party is the party of inclusion.  i feel that they embrace different ideas and care a great deal about the majority of americans,1,0,0,1,0,0,0,0,0,0,0,0,0,0,0,0,0,0,0,0,0,0,0,0,1,0,1,0,0,0,0,1,0
288,outlook on environment the global warming,0,0,0,0,0,0,0,0,0,0,0,0,0,0,0,0,0,0,0,0,0,0,0,1,0,0,0,0,0,0,0,0,0
289,support of equal rights and equal access to resources for minorities,0,0,0,0,0,0,0,0,0,0,0,0,0,0,0,0,0,0,0,1,0,0,0,0,1,0,0,0,0,0,0,0,0
