1847,they were trying to upset the american people,0,1,0,0,0,0,0,0,0,0,0,0,0,0,0,0,0,0,0,0,0,0,0,0,0,0
1848,"destroy our non-communist;liveer more freely, in our country, they were trying to shut it down//no",0,0,0,0,0,0,0,0,1,0,0,0,0,0,0,0,0,0,0,0,0,0,0,0,0,1
1849,trying to get attention and let uthe u.s. know what they can do,0,0,0,0,1,0,0,0,0,0,0,0,0,0,0,0,0,0,0,1,0,0,0,0,0,0
1850,disruption of our way of life//no,0,0,0,0,0,0,0,0,1,0,0,0,0,0,0,0,0,0,0,0,0,0,0,0,0,1
1851,show how they hate us,0,0,0,0,0,0,0,0,0,0,0,0,0,0,0,0,0,0,1,0,0,0,0,0,0,0
1852,tthat they were not invinceable//no,0,0,0,0,1,0,0,0,0,0,0,0,0,0,0,0,0,0,0,0,0,0,0,0,0,1
1853,breaking the financial backgroung of the us and letting them know that they were as vununable as anyone else,0,0,0,0,1,0,0,0,0,1,0,0,0,0,0,0,0,0,0,0,0,0,0,0,0,0
1854,accomplish what they wanted by killing alot of people and started war,0,0,0,1,0,1,0,0,0,0,0,0,0,0,0,0,0,0,0,0,0,0,0,0,0,0
1856,"trying to hurt and dismantle our goernemnet,nd trying to kill as many amerians aas possible//it was musculm related",0,1,0,1,0,0,0,0,0,0,1,0,0,0,0,0,0,0,0,0,0,1,0,0,0,0
1857,"trying to prove to american people that they were not out of reach, trying to bbring the government down/to advance their agenda//no",0,0,0,0,1,0,0,0,0,0,1,0,0,0,0,0,0,0,0,0,0,0,0,0,0,1
1858,"disputionn of us economy, safety",1,0,0,0,0,0,0,0,0,1,0,0,0,0,0,0,0,0,0,0,0,0,0,0,0,0
1859,that they ca;n come over and take control when they wanted//no,0,0,0,0,1,0,0,0,0,0,0,0,0,0,0,0,0,0,0,0,0,0,0,0,0,1
1860,fear,1,0,0,0,0,0,0,0,0,0,0,0,0,0,0,0,0,0,0,0,0,0,0,0,0,0
1861,showing us we can be hurt,0,0,0,0,1,0,0,0,0,0,0,0,0,0,0,0,0,0,0,0,0,0,0,0,0,0
1862,kill as many americans as possible,0,0,0,1,0,0,0,0,0,0,0,0,0,0,0,0,0,0,0,0,0,0,0,0,0,0
1864,accomplish economic disruption and social fear,1,0,0,0,0,0,0,0,0,1,0,0,0,0,0,0,0,0,0,0,0,0,0,0,0,0
1865,proving they could attack usa,0,0,0,0,1,0,0,0,0,0,0,0,0,0,0,0,0,0,0,0,0,0,0,0,0,0
1867,to scare us nd to prove that we are not as strong as we thought we were;,1,0,0,0,1,0,0,0,0,0,0,0,0,0,0,0,0,0,0,0,0,0,0,0,0,0
1868,"MAKE A STATEMENT, FEAR INTO AMERICAN PEOPLE",1,0,0,0,0,0,0,0,0,0,0,0,0,0,0,0,0,0,0,1,0,0,0,0,0,0
1869,treaten americans,1,0,0,0,0,0,0,0,0,0,0,0,0,0,0,0,0,0,0,0,0,0,0,0,0,0
1870,instill fear in our population which they did.,1,0,0,0,0,0,0,0,0,0,0,0,0,0,0,0,0,0,0,0,0,0,0,0,0,0
1871,bring down our government,0,0,0,0,0,0,0,0,0,0,1,0,0,0,0,0,0,0,0,0,0,0,0,0,0,0
1872,disrupt the government and show they could prove a point,0,0,0,0,1,0,0,0,0,0,1,0,0,0,0,0,0,0,0,0,0,0,0,0,0,0
1873,bring down democracy,0,0,0,0,0,0,0,1,0,0,0,0,0,0,0,0,0,0,0,0,0,0,0,0,0,0
1874,"HUGH THREAT, GAIN CONTROL OF THIS COUNTRY",0,0,0,0,1,0,1,0,0,0,0,0,0,0,0,0,0,0,0,0,0,0,0,0,0,0
1875,show there power,0,0,0,0,1,0,0,0,0,0,0,0,0,0,0,0,0,0,0,0,0,0,0,0,0,0
1876,show america they were not so big that someone could bring them down.,0,0,0,0,1,0,0,0,0,0,0,0,0,0,0,0,0,0,0,0,0,0,0,0,0,0
1877,to cripple our governmet;,0,0,0,0,0,0,0,0,0,0,1,0,0,0,0,0,0,0,0,0,0,0,0,0,0,0
1878,"disorganize the government, financial institutions, and just cause fear in the average people,",1,0,0,0,0,0,0,0,0,1,1,0,0,0,0,0,0,0,0,0,0,0,0,0,0,0
1879,make a stateemt that they have no tolenance with our involmenent with their country//to portray their power of having us suffer as they have suffered//that we are not a strony/better country than they are,0,0,0,0,1,0,0,0,0,0,0,1,0,0,0,0,0,0,0,0,0,0,0,0,0,0
1880,destroy the most important and notable thing that the united states has which is to get to the pentagon and to destroy and kill americans,0,0,0,1,0,0,1,0,0,0,1,0,0,0,1,0,0,0,0,0,0,0,0,0,0,0
1881,THEY WERE TRYING TO I DONT KNOW I THINK THEY WANTED TO DESTROY THE CITY AND THE GOVERNMENT AND GET ATTENTION,0,0,0,0,0,0,0,0,0,0,1,0,0,0,0,0,0,0,0,1,0,0,1,0,1,0
1882,trying to accomplish to send out a message to the u s not only can we go and bomb theyre country but that they could do it to us,0,0,0,0,1,0,0,0,0,0,0,0,1,0,0,0,0,0,0,0,0,0,0,0,0,0
1883,DISSENTION AMONG THE AMERICAN PEOPLE I DONT THINK THAT THEY WERE TRYING TO MAKE ANY STATEMENT,0,0,1,0,0,0,0,0,0,0,0,0,0,0,0,0,0,0,0,0,0,0,1,0,0,0
1885,they were trying to show that we are not as unvernaerable as we think we are and that we would not react the way that we did and when people get into thier movements or cause they can attack us and get away with it,0,0,0,0,1,0,1,0,0,0,0,1,0,0,0,0,0,0,0,0,0,0,0,0,0,0
1886,TO SCARE PEOPLE,1,0,0,0,0,0,0,0,0,0,0,0,0,0,0,0,0,0,0,0,0,0,0,0,0,0
1887,TO SHOW THEY HAD POWER TO GET ATTENTION,0,0,0,0,1,0,0,0,0,0,0,0,0,0,0,0,0,0,0,0,0,0,0,0,0,0
1888,nothing,0,0,0,0,0,0,0,0,0,0,0,0,0,0,0,0,0,0,0,0,0,0,0,0,0,1
1889,I GUESS THEY FIGURED THAT IT WAS THE BEST WAY TO KILL PEOPLE,0,0,0,1,0,0,0,0,0,0,0,0,0,0,0,0,0,0,0,0,0,0,0,0,0,0
1890,they were trying to hurt as many americans as they could and they did because they hurt a lot of people and i dont understand how it went undetected which was very sad and i think that is what they were trying to accomplish which they did,0,1,0,0,0,0,0,0,0,0,0,0,0,0,0,0,0,0,0,0,0,0,1,0,0,0
1892,i think they were trying to kill as many people as they could it was because someone sent them,0,0,0,1,0,0,0,0,0,0,0,0,0,0,0,0,0,0,0,0,0,0,0,0,0,0
1893,AH THEY WERE TRYING TO BE THEMSELVES AND SCARE PEOPLE SO THAT EVERYONE WOULD SEE THEM,1,0,0,0,0,0,0,0,0,0,0,0,0,0,0,0,0,0,0,1,0,0,1,0,0,0
1894,to hurt this nation,0,0,0,0,0,0,1,0,0,0,0,0,0,0,0,0,0,0,0,0,0,0,0,0,0,0
1896,I THINK THEY JUST WANTED TO KILL AS MANY PEOPLE AS THEY COULD AND I FEEL THAT THEY ACCOMPLISHED WHAT THEY WERE OUT TO DO,0,0,0,1,0,0,0,0,0,0,0,0,0,0,0,0,0,0,0,0,0,0,1,0,0,0
1897,i think that they could show that they could come in here that they could get the united states and take over,0,0,0,0,1,0,0,0,0,0,0,0,0,0,0,0,0,0,0,0,0,0,0,0,0,0
1898,I THINK TO KILL EVERYONE THEY WERE NOT THINKING ABOUT ANYTHING BUT DOING BAD,0,0,0,1,0,0,0,0,0,0,0,0,0,0,0,0,0,0,1,0,0,0,0,0,0,0
1899,i guess take the big government,0,0,0,0,0,0,0,0,0,0,1,0,0,0,0,0,0,0,0,0,0,0,0,0,0,0
1900,TO PROVE A POINT THAT THEY COULD GET AWAY WITH IT AND WE THINK THAT IT COULD NEVER HAPPEN TO US I BELIEVE WE WERE NAIVE,0,0,0,0,1,0,0,0,0,0,0,0,0,0,0,0,0,0,0,0,0,0,0,0,0,0
1901,to disrupt the government and to show that they were better than us at that time,0,0,0,0,1,0,0,0,0,0,1,0,0,0,0,0,0,0,0,0,0,0,0,0,0,0
1902,vengence \\ or maybe what they were promised in heavan so many virgins,0,0,0,0,0,0,0,0,0,0,0,0,1,0,0,0,0,0,0,0,0,1,0,0,0,0
1903,get attention that we were vulnerable,0,0,0,0,1,0,0,0,0,0,0,0,0,0,0,0,0,0,0,0,0,0,0,0,0,0
1906,fear,1,0,0,0,0,0,0,0,0,0,0,0,0,0,0,0,0,0,0,0,0,0,0,0,0,0
1907,to instill fear in the us,1,0,0,0,0,0,0,0,0,0,0,0,0,0,0,0,0,0,0,0,0,0,0,0,0,0
1908,i dont know,0,0,0,0,0,0,0,0,0,0,0,0,0,0,0,0,0,0,0,0,0,0,0,0,1,0
1909,i dont know,0,0,0,0,0,0,0,0,0,0,0,0,0,0,0,0,0,0,0,0,0,0,0,0,1,0
1910,terrorize america,1,0,0,0,0,0,0,0,0,0,0,0,0,0,0,0,0,0,0,0,0,0,0,0,0,0
1911,bring down the us governmnet the pentagon fiancial institutions and financial stability,0,0,0,0,0,0,0,0,0,1,1,0,0,0,0,0,0,0,0,0,0,0,0,0,0,0
1912,to the american people showed that they had power and the intellegence that they had to do what they did,0,0,0,0,1,0,0,0,0,0,0,0,0,0,0,0,0,0,0,0,0,0,0,0,0,0
1913,distroy the united states,0,0,0,0,0,0,1,0,0,0,0,0,0,0,0,0,0,0,0,0,0,0,0,0,0,0
1914,<DK>,0,0,0,0,0,0,0,0,0,0,0,0,0,0,0,0,0,0,0,0,0,0,0,0,1,0
1915,i dont know,0,0,0,0,0,0,0,0,0,0,0,0,0,0,0,0,0,0,0,0,0,0,0,0,1,0
1916,i dont know,0,0,0,0,0,0,0,0,0,0,0,0,0,0,0,0,0,0,0,0,0,0,0,0,1,0
1917,fear,1,0,0,0,0,0,0,0,0,0,0,0,0,0,0,0,0,0,0,0,0,0,0,0,0,0
1918,I dont think i dont know but I think they didn't accomplish anything,0,0,0,0,0,0,0,0,0,0,0,0,0,0,0,0,0,0,0,0,0,0,1,0,1,0
1919,wanted to destroy everything,0,0,0,0,0,0,1,0,0,0,0,0,0,0,0,0,0,0,0,0,0,0,0,0,0,0
1920,THEY ARE ACCORDING TO THEM THEY ARE TRYING TO GAIN THE ATTENTION OF THE AMERICAN SOCIETY OR GOVERNMENT BY ATTACKING THIS NATION ALSO ATTEMPTING TO DESTROY OUR WAY OF LIFE AND THEY ARE IN THE MIDDLE OF THREATENING OUR FREEDOMS,0,0,0,0,0,0,1,0,1,0,0,0,0,0,0,0,0,0,0,1,0,0,0,0,0,0
1921,i dont know,0,0,0,0,0,0,0,0,0,0,0,0,0,0,0,0,0,0,0,0,0,0,0,0,1,0
1922,TRYING TO SCARE PEOPLE AND TRY TO GET THE POINT ACROSS THAT NOBODY IS SAFE FROM THEM,1,0,0,0,1,0,0,0,0,0,0,0,0,0,0,0,0,0,0,0,0,0,0,0,0,0
1923,I THINK THEY ARE TRYING TO GET US TO THINK ABOUT WHAT WE ARE DOING IN THE WORLD AND WHY,0,0,0,0,0,0,0,0,0,0,0,0,0,0,0,0,0,0,0,1,0,0,0,0,0,0
1925,THEY WANTED WAR AND THEY DID IT,0,0,0,0,0,1,0,0,0,0,0,0,0,0,0,0,0,0,0,0,0,0,0,0,0,0
1926,JUST TO GET REVENGE ABOUT SOMETHING THAT WAS DONE TO THEM,0,0,0,0,0,0,0,0,0,0,0,0,1,0,0,0,0,0,0,0,0,0,0,0,0,0
1927,THEY WERE TRYING TO SCARE US I GUESS,1,0,0,0,0,0,0,0,0,0,0,0,0,0,0,0,0,0,0,0,0,0,0,0,0,0
1928,control,0,0,0,0,1,0,0,0,0,0,0,0,0,0,0,0,0,0,0,0,0,0,0,0,0,0
1930,I DONT KNOW BY HITTING THE TOWERS THEY WERE TRYING TO INITIALLY THE TOWERS HELD SO MUCH THEY WERE TRYING TO BREAK THE SYSTEMS I REALLY DONT KNOW WHY THEY DID IT,0,0,0,0,0,0,0,0,0,0,1,0,0,1,0,0,0,0,0,0,0,0,0,0,1,0
1931,and freighten,1,0,0,0,0,0,0,0,0,0,0,0,0,0,0,0,0,0,0,0,0,0,0,0,0,0
1932,TO DISRUPT THE UNITED STATES TRYING TO HURT THE GOVERNMENT,0,0,0,0,0,0,1,0,0,0,1,0,0,0,0,0,0,0,0,0,0,0,0,0,0,0
1933,a warning like beware i guess,0,0,0,0,1,0,0,0,0,0,0,0,0,0,0,0,0,0,0,0,0,0,0,0,0,0
1934,a feeling of power they want to feel powerful and demonstrate thier anger and hate towards the U.S,0,0,0,0,1,0,0,0,0,0,0,0,0,0,0,0,0,0,1,0,0,0,0,0,0,0
1935,they were trying to well trying to destroy our freedoms and values and trying to get even i guess,0,0,0,0,0,0,0,0,1,0,0,0,1,0,0,0,0,0,0,0,0,0,0,0,0,0
1936,they were trying to control the  U. S. and to show the whole world what the U S is really like,0,0,0,0,1,0,0,0,0,0,0,0,0,0,0,0,0,0,0,0,0,0,0,0,0,0
1937,I DONT KNOW I GUESS THEY WANT ED TO PROVE THAT THE U S WAS NOT SO POWERFUL AS OTHER COUNTRIES AND WE TO CAN BE ATTACKED,0,0,0,0,1,0,0,0,0,0,0,0,0,0,0,0,0,0,0,0,0,0,0,0,1,0
1938,inflict pain and terror,1,1,0,0,0,0,0,0,0,0,0,0,0,0,0,0,0,0,0,0,0,0,0,0,0,0
1939,kill americans and get their 72 virgins,0,0,0,1,0,0,0,0,0,0,0,0,0,0,0,0,0,0,0,0,0,1,0,0,0,0
1940,they love the sight of blood killing is the only thing they know blood thirsty,0,0,0,1,0,0,0,0,0,0,0,0,0,0,0,0,0,0,0,0,0,0,0,0,0,0
1942,demoralize the nation,0,0,1,0,0,0,0,0,0,0,0,0,0,0,0,0,0,0,0,0,0,0,0,0,0,0
1943,weaken the us economy and send a political statement saying the us was weak,0,0,0,0,1,0,0,0,0,1,0,0,0,0,0,0,0,0,0,0,0,0,0,0,0,0
1945,hatred stupidity i dont know what else they would have been thinking,0,0,0,0,0,0,0,0,0,0,0,0,0,0,0,0,0,0,1,0,0,0,1,0,1,0
1946,i think it was just anger,0,0,0,0,0,0,0,0,0,0,0,0,0,0,0,0,0,0,1,0,0,0,0,0,0,0
1947,make a statement \\ that the us is valunerable,0,0,0,0,1,0,0,0,0,0,0,0,0,0,0,0,0,0,0,1,0,0,0,0,0,0
1948,instill fear\\yea,1,0,0,0,0,0,0,0,0,0,0,0,0,0,0,0,0,0,0,0,0,0,0,1,0,0
1949,a downfall of the united states they thought it would break us,0,0,0,0,0,0,1,0,0,0,0,0,0,0,0,0,0,0,0,0,0,0,0,0,0,0
1950,tell us that they dont like us and trying toscare us,1,0,0,0,0,0,0,0,0,0,0,0,0,0,0,0,0,0,1,0,0,0,0,0,0,0
1951,get attention,0,0,0,0,0,0,0,0,0,0,0,0,0,0,0,0,0,0,0,1,0,0,0,0,0,0
1952,and to kill as many americans as they could and they will continjue to do so they dont like americans,0,0,0,1,0,0,0,0,0,0,0,0,0,0,0,0,0,0,1,0,0,0,0,0,0,0
1955,that they were superior um that they could infratrate our government that they didnt lkike us at all,0,0,0,0,1,0,0,0,0,0,1,0,0,0,0,0,0,0,1,0,0,0,0,0,0,0
1956,\\ they wanted to punish us for being i sadi arabia,0,0,0,0,0,0,0,0,0,0,0,1,1,0,0,0,0,0,0,0,0,0,0,0,0,0
1957,To scare us.,1,0,0,0,0,0,0,0,0,0,0,0,0,0,0,0,0,0,0,0,0,0,0,0,0,0
1958,they wanted to let us know that we are not in control as we think we are,0,0,0,0,1,0,0,0,0,0,0,0,0,0,0,0,0,0,0,0,0,0,0,0,0,0
1960,there was no rational or logical thought behind it,0,0,0,0,0,0,0,0,0,0,0,0,0,0,0,0,1,0,0,0,0,0,0,0,0,0
1961,Trying to get our attention.,0,0,0,0,0,0,0,0,0,0,0,0,0,0,0,0,0,0,0,1,0,0,0,0,0,0
1962,to scare americans,1,0,0,0,0,0,0,0,0,0,0,0,0,0,0,0,0,0,0,0,0,0,0,0,0,0
1963,Fear & a message,1,0,0,0,0,0,0,0,0,0,0,0,0,0,0,0,0,0,0,1,0,0,0,0,0,0
1964,Prove a point,0,0,0,0,0,0,0,0,0,0,0,0,0,0,0,0,0,0,0,1,0,0,0,0,0,0
1966,to strike fear in all americans//none,1,0,0,0,0,0,0,0,0,0,0,0,0,0,0,0,0,0,0,0,0,0,0,0,0,1
1967,to intimidate the u.s.//to show power//hurt us economically// destroy as much as possible- american icons,1,0,0,0,1,0,1,0,0,1,0,0,0,0,1,0,0,0,0,0,0,0,0,0,0,0
1968,invade the united states,0,0,0,0,0,1,0,0,0,0,0,0,0,0,0,0,0,0,0,0,0,0,0,0,0,0
1970,to let the americans know that they are strong // that they can cause havoc in america//none,0,0,1,0,1,0,0,0,0,0,0,0,0,0,0,0,0,0,0,0,0,0,0,0,0,1
1971,"trhying to let us know they can come into our country7 and do what they please with us, not afraid to attack us",0,0,0,0,1,0,0,0,0,0,0,0,0,0,0,0,0,0,0,0,0,0,0,0,0,0
1972,to let us k now that we are nit invinsible// that we can be destroyed//none,0,0,0,0,1,0,0,0,0,0,0,0,0,0,0,0,0,0,0,0,0,0,0,0,0,1
1973,a warning,0,0,0,0,1,0,0,0,0,0,0,0,0,0,0,0,0,0,0,0,0,0,0,0,0,0
1974,i dont know what they were trying to accomplish by their actions,0,0,0,0,0,0,0,0,0,0,0,0,0,0,0,0,0,0,0,0,0,0,0,0,1,0
1975,take of control of the united states or the whole world,0,0,0,0,0,0,1,0,0,0,0,0,0,0,0,0,0,0,0,0,0,0,0,0,0,0
1976,fearxxx,1,0,0,0,0,0,0,0,0,0,0,0,0,0,0,0,0,0,0,0,0,0,0,0,0,0
1977,does not knowx,0,0,0,0,0,0,0,0,0,0,0,0,0,0,0,0,0,0,0,0,0,0,0,0,1,0
1978,has no idea,0,0,0,0,0,0,0,0,0,0,0,0,0,0,0,0,0,0,0,0,0,0,0,0,1,0
1980,"they were tr4y9ingt to get us to , because we are in their country and hurtn their people, they used tht reason to attack us",0,0,0,0,0,0,0,0,0,0,0,1,0,0,0,0,0,0,0,0,0,0,1,0,0,0
1981,To debilitate the US-to ruin it,0,0,0,0,0,0,1,0,0,0,0,0,0,0,0,0,0,0,0,0,0,0,0,0,0,0
1982,Kill people,0,0,0,1,0,0,0,0,0,0,0,0,0,0,0,0,0,0,0,0,0,0,0,0,0,0
1983,Trying to scare the United States,1,0,0,0,0,0,0,0,0,0,0,0,0,0,0,0,0,0,0,0,0,0,0,0,0,0
1984,Trying to say they were in control.,0,0,0,0,1,0,0,0,0,0,0,0,0,0,0,0,0,0,0,0,0,0,0,0,0,0
1985,Scare us,1,0,0,0,0,0,0,0,0,0,0,0,0,0,0,0,0,0,0,0,0,0,0,0,0,0
1986,Terror-they were trying to make the US look bad.,1,0,0,0,1,0,0,0,0,0,0,0,0,0,0,0,0,0,0,0,0,0,0,0,0,0
1987,Get the world's attention & to hurt the U.S. econically & to prove they could.,0,0,0,0,1,0,0,0,0,1,0,0,0,0,0,0,0,0,0,1,0,0,0,0,0,0
1989,To get our attention,0,0,0,0,0,0,0,0,0,0,0,0,0,0,0,0,0,0,0,1,0,0,0,0,0,0
1990,"They wanted America to know they are not invincible & if another country wants to come in here & kill & maim, they will.",0,1,0,1,1,0,0,0,0,0,0,0,0,0,0,0,0,0,0,0,0,0,0,0,0,0
1991,um bring attention to their religion through their eyes,0,0,0,0,0,0,0,0,0,0,0,0,0,0,0,0,0,0,0,1,0,1,0,0,0,0
1992,Publicity,0,0,0,0,0,0,0,0,0,0,0,0,0,0,0,0,0,0,0,1,0,0,0,0,0,0
1993,strike fear,1,0,0,0,0,0,0,0,0,0,0,0,0,0,0,0,0,0,0,0,0,0,0,0,0,0
1994,take out symbol of am. trade and finance; proving our vulnerability; show how powerful Islam actually is,0,0,0,0,1,0,0,0,0,0,0,0,0,0,1,0,0,0,0,0,0,1,0,0,0,0
1995,warning,0,0,0,0,1,0,0,0,0,0,0,0,0,0,0,0,0,0,0,0,0,0,0,0,0,0
1996,to prove our vulnerability,0,0,0,0,1,0,0,0,0,0,0,0,0,0,0,0,0,0,0,0,0,0,0,0,0,0
1997,kill american citizens and show power,0,0,0,1,1,0,0,0,0,0,0,0,0,0,0,0,0,0,0,0,0,0,0,0,0,0
1998,terror and lack of confidence; fear,1,0,0,0,0,0,0,0,0,0,0,0,0,0,0,0,0,0,0,0,0,0,0,0,0,0
1999,tell US they did not want US involved in their gov.,0,0,0,0,0,0,0,0,0,0,0,1,0,0,0,0,0,0,0,0,0,0,0,0,0,0
2000,scare americans,1,0,0,0,0,0,0,0,0,0,0,0,0,0,0,0,0,0,0,0,0,0,0,0,0,0
2001,political statement and to disrupt or cripple our society,0,0,1,0,0,0,1,0,0,0,0,0,0,0,0,0,0,0,0,1,0,0,0,0,0,0
2002,they were jealous; out of mind,0,0,0,0,0,0,0,0,0,0,0,0,0,0,0,0,1,1,0,0,0,0,0,0,0,0
2003,shutting down our financial services and killing people,0,0,0,1,0,0,0,0,0,1,0,0,0,0,0,0,0,0,0,0,0,0,0,0,0,0
2004,taking out our icons; send a message,0,0,0,0,0,0,0,0,0,0,0,0,0,0,1,0,0,0,0,1,0,0,0,0,0,0
2005,statement about american society; religion so skewed that they don't really know what they are doing; they are brainwashed,0,0,0,0,0,0,0,0,0,0,0,0,0,0,0,0,1,0,0,0,0,1,1,0,0,0
2006,evil; hurt the american infrastructure,0,0,0,0,0,0,0,0,0,0,1,0,0,0,0,0,0,0,1,0,0,0,0,0,0,0
2007,wake us up to their serious intent,0,0,0,0,1,0,0,0,0,0,0,0,0,0,0,0,0,0,0,0,0,0,0,0,0,0
2008,THEY TRIED TO MAKE A POINT ON THEIR BELIEFS AS TERRORISTS//NO,0,0,0,0,0,0,0,0,0,0,0,0,0,0,0,0,0,0,0,1,0,1,0,0,0,1
2009,"WE ARE NUMBER ONE NATION OF EQUALITY AND A VERY POWERFUL COUNTRY, THEY WANTED TO SHOW US THAT THEY ARE NOT GOING TO TOLERATE OUR KINDENESS, OUR NATION THAT IS RICH AND POWERFUL BUT ALSO AT THE SAME TIME A COUNTRY OF EQUALITY NO COMUNISM, THEY WANTED TO SHOW US THAT THEY ARE VERY JEALOUS, JUST TO SHOW US THEY WANT TO RUN THE WORLD, THAT'S MY OPINION//JELOUSY AND BITTER COUNTRY THAT DOESN'T WANT OUR COUNTRY THE WAY ARE, HELPING OTHERS AND LOVING OUR NATION//THEIR NEEDING TO LET US KNOW THAT THEY WANT TO RUN COMMUNISM OR RUN THE WORLD//OUR COUNTRY IS A COUNTRY OF KINDENESS, EQUILITY AND A COUNTRY OF LIBERTY AND PROPSERITY AND OUR BLESSINGS TO ALL OUR NATIONS, THAT IS WHAT THEY DON'T LIKE, THEY DISLIKE WHAT OUR COUNTRY STANDS FOR (PLURIS UNUM)",0,0,0,0,1,0,0,0,0,0,0,0,0,0,0,0,0,1,0,0,0,0,0,1,0,0
2010,"TO HURT US//THEY DON'T LIKE US, THOSE PEOPLE DON'T LIKE US, THEY WANT TO SEE US DESTROYED// THEY WANTED TO DESTROY OUR WAY OF GOVERNMENT//STOP",0,0,0,0,0,0,1,0,0,0,1,0,0,0,0,0,0,0,1,0,0,0,0,0,0,1
2011,I have no idea.  I don't know.,0,0,0,0,0,0,0,0,0,0,0,0,0,0,0,0,0,0,0,0,0,0,0,0,1,0
2012,proving that we are not as secure as we thought.//no,0,0,0,0,1,0,0,0,0,0,0,0,0,0,0,0,0,0,0,0,0,0,0,0,0,1
2013,they were trying to make the American people fearful and destroy the confidence of the American people and the economy of the American people and lose faith in our president and in our government,1,0,1,0,0,0,0,0,0,1,0,0,0,0,0,0,0,0,0,0,0,0,0,0,0,0
2014,"complex thing, undermine the American economy and feeling of security.",1,0,1,0,0,0,0,0,0,1,0,0,0,0,0,0,0,0,0,0,0,0,0,0,0,0
2015,"they want to scare us that is for sure, they want to take over, I still remember.  They are not afraid, they don't care.",1,0,0,0,1,0,1,0,0,0,0,0,0,0,0,0,0,0,1,0,0,0,0,0,0,0
2016,that they are not afraid and are tired of the U.S.,0,0,0,0,1,0,0,0,0,0,0,0,0,0,0,0,0,0,0,0,0,0,0,0,0,0
2017,to show their anger against the U.S.,0,0,0,0,0,0,0,0,0,0,0,0,0,0,0,0,0,0,1,0,0,0,0,0,0,0
2018,vengeance // they just don't like America,0,0,0,0,0,0,0,0,0,0,0,0,1,0,0,0,0,0,1,0,0,0,0,0,0,0
2019,"they were trying to hit us where, actually hit us where the economy would be felt.",0,0,0,0,0,0,0,0,0,1,0,0,0,0,0,0,0,0,0,0,0,0,0,0,0,0
2020,"to make us fear, I guess to put us in fear.",1,0,0,0,0,0,0,0,0,0,0,0,0,0,0,0,0,0,0,0,0,0,0,0,0,0
2021,"They wanted to end with the people there in New York and give proof that they can dominate the U.S.//An announcement from their country to the U.S. ""we coming and be prepared because we will do more.//no",0,0,0,0,1,0,0,0,0,0,0,0,0,0,0,0,0,0,0,0,0,0,1,0,0,1
2023,fear,1,0,0,0,0,0,0,0,0,0,0,0,0,0,0,0,0,0,0,0,0,0,0,0,0,0
2024,They can do anything against the United States.//no,0,0,0,0,1,0,0,0,0,0,0,0,0,0,0,0,0,0,0,0,0,0,0,0,0,1
2026,INDUCE FEAR//MAKE US THINK THAT WE ARE WEAK//TO MAKE US THINK THAT WE CAN BE ATTACKED AT ANY TIME IN ANY WAY//STOP,1,0,0,0,1,0,0,0,0,0,0,0,0,0,0,0,0,0,0,0,0,0,0,0,0,1
2027,to get our attention.//no,0,0,0,0,0,0,0,0,0,0,0,0,0,0,0,0,0,0,0,1,0,0,0,0,0,1
2028,atemorizara a los Estados Unidos,1,0,0,0,0,0,0,0,0,0,0,0,0,0,0,0,0,0,0,0,0,0,0,0,0,0
2029,TO PROVE A POINT TO AMERICANS THAT AMERICA IS NOT INVICIBLE//TO TELL AMERICA TO BUT OUT OF THEIR BUSINESS//NO,0,0,0,0,1,0,0,0,0,0,0,1,0,0,0,0,0,0,0,0,0,0,0,0,0,1
2030,"trying to send a message  to disrupt American security, in their minds dystroying the infidels.",1,0,0,0,1,0,0,0,0,0,0,0,0,0,0,0,0,0,0,0,0,1,0,0,0,0
2031,"show their power in the U.S., a threat that they can take over.",0,0,0,0,1,0,0,0,0,0,0,0,0,0,0,0,0,0,0,0,0,0,0,0,0,0
2032,FINISH WITH THE ECONOMY OF THE USA// LEAVE US IN THE STREET//STOP,0,0,0,0,0,0,0,0,0,1,0,0,0,0,0,0,0,0,0,0,0,0,0,0,0,1
2034,"that they basically hate Americans,  it was just done out of hatred towards Americans",0,0,0,0,0,0,0,0,0,0,0,0,0,0,0,0,0,0,1,0,0,0,0,0,0,0
2035,proving how easy it is to kill Americans.(\\)no\\,0,0,0,1,1,0,0,0,0,0,0,0,0,0,0,0,0,0,0,0,0,0,0,0,0,1
2036,THEY WERE CRAZY//THAT THEY COULD BECOME A THREAT//THAT WE WERE NOT INVINCIBLE//NO,0,0,0,0,1,0,0,0,0,0,0,0,0,0,0,0,1,0,0,0,0,0,0,0,0,1
2037,"they were wanting to make a statement, how much they the U.S. and want to destroy us.",0,0,0,0,0,0,1,0,0,0,0,0,0,0,0,0,0,0,0,1,0,0,1,0,0,0
2038,"demostrar que ellos son mas poderosos,",0,0,0,0,1,0,0,0,0,0,0,0,0,0,0,0,0,0,0,0,0,0,0,0,0,0
2040,"THEY WERE TRYING TO ATTACK THE UNITED STATES WHERE IT HURTS THE MOST, THE ECONOMY, AND TO KILL AS MANY PEOPLE IN THE PROCESS//THEY WERE TRYING TO JOLT THIS COUNTRY, TO DISTURB US, AND TO TAKE US OUT OF OUR COMFORT//NO",1,1,0,1,0,0,1,0,0,0,0,0,0,0,0,0,0,0,0,0,0,0,0,0,0,1
2041,TO GET BACK AT THE UNITED STATES//NO,0,0,0,0,0,0,0,0,0,0,0,0,1,0,0,0,0,0,0,0,0,0,0,0,0,1
2042,they were trying to hurt our economy.,0,0,0,0,0,0,0,0,0,1,0,0,0,0,0,0,0,0,0,0,0,0,0,0,0,0
2043,"I say that they did this because they were against Bush, this all happened because of Bush.  Because they were against President Bush and his father.",0,0,0,0,0,0,0,0,0,0,0,0,0,0,0,0,0,0,1,0,0,0,1,0,0,0
2044,TRYING TO DEMONSTRATE THAT THEY COULD DO IT//IT WAS A MATTER OF INTIMIDATION OF THE U.S.//,1,0,0,0,1,0,0,0,0,0,0,0,0,0,0,0,0,0,0,0,0,0,0,0,0,0
2045,they were trying to intimidate us,1,0,0,0,0,0,0,0,0,0,0,0,0,0,0,0,0,0,0,0,0,0,0,0,0,0
2046,HATE TOWARD THE U.S.//TELLING PRESIDENT BUSH NOT TO BUT IN BUT TO LEAVE THEM ALONE//NO,0,0,0,0,0,0,0,0,0,0,0,1,0,0,0,0,0,0,1,0,0,0,0,0,0,1
2048,PAIN AND SUFFERING//RELIGIOUS REVENGE//STOP,0,1,0,0,0,0,0,0,0,0,0,0,1,0,0,0,0,0,0,0,0,1,0,0,0,1
2049,"that they are the top dogs I think they were aiming at the White House, but it did not happen I just happen to have read on it recently. FI:  anything else R: no, she mentioned same comments again. //None",0,0,0,0,1,0,0,0,0,0,0,0,0,0,0,0,0,0,0,0,0,0,1,0,0,1
2050,"I know what they were trying to accomplish.. I don't agree wit their views/beliefs.  they believe tht the US is the devil and  they worship they believe in the KORAN AND aLA Ala, tey belive we are tghe devils ...",0,0,0,0,0,0,0,0,0,0,0,0,0,0,0,0,0,0,0,0,0,1,1,0,0,0
2051,//I would not know//fI:  any thoughts about it?// R:  No (just shook head)//none,0,0,0,0,0,0,0,0,0,0,0,0,0,0,0,0,0,0,0,0,0,0,0,0,1,1
2052,"destruction, and destroying people, hatrad nothing good cames out of it.... control of the nation religion...",0,0,0,1,0,0,1,0,0,0,0,0,0,0,0,0,0,0,1,0,0,1,1,0,0,0
2053,"they were trying to scare us to death.. which they did//well, to show how much influence they have.. they trained here in the states and the govemnent let them in!!! they government do not ck on anything.///",1,0,0,0,1,0,0,0,0,0,0,0,0,0,0,0,0,0,0,0,0,0,1,0,0,0
2054,they wanted to kill the President//for the economy to be brought down//for us to grow apart//none,0,0,0,0,0,0,1,0,0,1,0,0,0,0,0,1,0,0,0,0,0,0,0,0,0,1
2055,THEY TRIED TO INSTALL FEAR IN PEOPLE OF THE UNITED STATES AND THEY SUCCEDED,1,0,0,0,0,0,0,0,0,0,0,0,0,0,0,0,0,0,0,0,0,0,0,0,0,0
2056,"to kill as much people as they can, could also be revenege against the president //none",0,0,0,1,0,0,0,0,0,0,0,0,1,0,0,0,0,0,0,0,0,0,0,0,0,1
2057,"i do not know killing people, just an act of terrorism, maybe proving they could.. I really don't know...",1,0,0,1,1,0,0,0,0,0,0,0,0,0,0,0,0,0,0,0,0,0,0,0,1,0
2058,I don't know. FI:  any idea ? R:  I don't know... I haven't really tought about it.,0,0,0,0,0,0,0,0,0,0,0,0,0,0,0,0,0,0,0,0,0,0,0,0,1,0
2059,"i think they were trying to say that they can do this..... they wanted to kill people, they wanted to show the governmnet that we are not immunlu to terrorist, they they can also come in and do things. //none",0,0,0,1,1,0,0,0,0,0,0,0,0,0,0,0,0,0,0,0,0,0,0,0,0,1
2060,i think the terrorist (pause) I never been able to figure out what they were wanting.. I think they were just trying to take their nation's problems on America.,0,0,0,0,0,0,0,0,0,0,0,0,1,0,0,0,0,0,0,0,0,0,0,0,1,0
2061,cause they did not want the United States to involve themselves in the business of their country.,0,0,0,0,0,0,0,0,0,0,0,1,0,0,0,0,0,0,0,0,0,0,0,0,0,0
2062,//I believe they were trying to kill Bush//nothing else to add//none,0,0,0,0,0,0,0,0,0,0,0,0,0,0,0,1,0,0,0,0,0,0,0,0,0,1
2063,DESTROY THE US.  MAKE US ANGRY/ THAT IS IT....,0,0,0,0,0,0,1,0,0,0,0,0,0,0,0,0,0,0,0,0,0,0,1,0,0,1
2064,Fear. Send out a notice that we are not well protected that we are vulnerable.,1,0,0,0,1,0,0,0,0,0,0,0,0,0,0,0,0,0,0,0,0,0,0,0,0,0
2065,"I don't know. FI:  any ideas that may cross your mind? R:  None, I don't know.",0,0,0,0,0,0,0,0,0,0,0,0,0,0,0,0,0,0,0,0,0,0,0,0,1,1
2066,they were trying the U.S. that they were not invincible and that this martyrs have been raised since children to become one.,0,0,0,0,1,0,0,0,0,0,0,0,0,0,0,0,0,0,0,0,0,0,1,0,0,0
2067,I do not know what those guys were thinking... It is a good questions...d,0,0,0,0,0,0,0,0,0,0,0,0,0,0,0,0,0,0,0,0,0,0,0,0,1,0
2068,"desequilibrar el govierno de estados unidos en frente del otros goviernos para demostrar que no son tan fuertes como lo pensaban... demostrar que somos vulnerables. to show the world that the government of the United States is not as strong as it appears to be, to make us loose our balance and to show that we can be vulnerable.",0,0,1,0,1,0,0,0,0,0,0,0,0,0,0,0,0,0,0,0,0,0,0,0,0,0
2069,i do not know.... to kill....,0,0,0,1,0,0,0,0,0,0,0,0,0,0,0,0,0,0,0,0,0,0,0,0,1,0
2070,//they were trying to destroy us//none//,0,0,0,0,0,0,1,0,0,0,0,0,0,0,0,0,0,0,0,0,0,0,0,0,0,1
2072,cause attention,0,0,0,0,0,0,0,0,0,0,0,0,0,0,0,0,0,0,0,1,0,0,0,0,0,0
2073,i tought it was personal against President Bush//and they did not care who else they hurt/they even took their lives//none,0,0,0,1,0,0,0,0,0,0,0,0,0,0,0,1,0,0,1,0,0,0,0,0,0,1
